name,has_yaml,copies,description,kept_source_path,other_copy_paths
engagement-survey,yes,1,"Design, administer, and analyze employee engagement surveys with action planning",C:\Users\Treml\.claude\plugins\marketplaces\a5c.ai\library\specializations\domains\business\human-resources\skills\engagement-survey\SKILL.md,
engineering-report-generator,yes,1,Engineering report generation skill for standard technical reports and calculation sheets,C:\Users\Treml\.claude\plugins\marketplaces\a5c.ai\library\specializations\domains\science\civil-engineering\skills\engineering-report-generator\SKILL.md,
ensembl-skill,yes,1,"Submit compact Ensembl REST API requests for lookup, overlap, cross-reference, and variation endpoints. Use when a user wants concise Ensembl summaries",C:\Users\Treml\.codex\.tmp\plugins\plugins\life-science-research\skills\ensembl-skill\SKILL.md,
entity-management,yes,1,Track and manage subsidiary and entity information,C:\Users\Treml\.claude\plugins\marketplaces\a5c.ai\library\specializations\domains\business\legal\skills\entity-management\SKILL.md,
entity-memory-extraction,yes,1,Entity and fact extraction for user profiling and personalization,C:\Users\Treml\.claude\plugins\marketplaces\a5c.ai\library\specializations\ai-agents-conversational\skills\entity-memory-extraction\SKILL.md,
env-var-mapper,yes,1,"Generate environment variable to CLI argument mapping with prefix support, type conversion, and fallback chains for configuration.",C:\Users\Treml\.claude\plugins\marketplaces\a5c.ai\library\specializations\cli-mcp-development\skills\env-var-mapper\SKILL.md,
env-vars,yes,1,"Vercel environment variable expert guidance. Use when working with .env files, vercel env commands, OIDC tokens, or managing environment-specific configuration.",C:\Users\Treml\.claude\plugins\cache\claude-plugins-official\vercel\0.42.1\skills\env-vars\SKILL.md,
env-vars,yes,1,"Vercel environment variable expert guidance. Use when working with .env files, vercel env commands, OIDC tokens, or managing environment-specific configuration.",C:\Users\Treml\.codex\.tmp\plugins\plugins\vercel\skills\env-vars\SKILL.md,
environmental-fate-modeler,yes,1,Environmental nanosafety skill for modeling nanomaterial environmental fate and transport,C:\Users\Treml\.claude\plugins\marketplaces\a5c.ai\library\specializations\domains\science\nanotechnology\skills\environmental-fate-modeler\SKILL.md,
environmental-impact-analyzer,yes,1,"Environmental impact assessment skill for NEPA, wetlands, and endangered species screening",C:\Users\Treml\.claude\plugins\marketplaces\a5c.ai\library\specializations\domains\science\civil-engineering\skills\environmental-impact-analyzer\SKILL.md,
environmental-testing,yes,1,Skill for environmental test campaign planning and execution,C:\Users\Treml\.claude\plugins\marketplaces\a5c.ai\library\specializations\domains\science\aerospace-engineering\skills\environmental-testing\SKILL.md,
epic-generation,no,1,,C:\Users\Treml\.claude\plugins\marketplaces\a5c.ai\library\methodologies\ccpm\skills\epic-generation\SKILL.md,
epic-sdk,yes,1,Epic Online Services skill for launcher integration.,C:\Users\Treml\.claude\plugins\marketplaces\a5c.ai\library\specializations\game-development\skills\epic-sdk\SKILL.md,
epics-control-system,yes,1,EPICS control system skill for accelerator and beamline instrument control and monitoring,C:\Users\Treml\.claude\plugins\marketplaces\a5c.ai\library\specializations\domains\science\physics\skills\epics-control-system\SKILL.md,
epigraphdb-skill,yes,1,"Submit compact EpiGraphDB API requests for ontology, literature, MR, gene-drug, and support-path evidence. Use when a user wants concise EpiGraphDB summaries",C:\Users\Treml\.codex\.tmp\plugins\plugins\life-science-research\skills\epigraphdb-skill\SKILL.md,
eps-calibration,yes,1,Electric power steering calibration and control development,C:\Users\Treml\.claude\plugins\marketplaces\a5c.ai\library\specializations\domains\science\automotive-engineering\skills\eps-calibration\SKILL.md,
eqtl-catalogue-skill,yes,1,Submit compact eQTL Catalogue API requests for association retrieval and documented metadata endpoints. Use when a user wants concise public eQTL Catalogue summaries,C:\Users\Treml\.codex\.tmp\plugins\plugins\life-science-research\skills\eqtl-catalogue-skill\SKILL.md,
equipment-sizing-calculator,yes,1,Process equipment sizing skill using established engineering correlations and standards,C:\Users\Treml\.claude\plugins\marketplaces\a5c.ai\library\specializations\domains\science\chemical-engineering\skills\equipment-sizing-calculator\SKILL.md,
Error Messages,yes,1,Expert skill for designing and implementing high-quality compiler error messages,C:\Users\Treml\.claude\plugins\marketplaces\a5c.ai\library\specializations\programming-languages\skills\error-messages\SKILL.md,
error-code-catalog,yes,1,Manage and document SDK error codes and messages,C:\Users\Treml\.claude\plugins\marketplaces\a5c.ai\library\specializations\sdk-platform-development\skills\error-code-catalog\SKILL.md,
error-logging,no,1,,C:\Users\Treml\.claude\plugins\marketplaces\a5c.ai\library\methodologies\planning-with-files\skills\error-logging\SKILL.md,
esbuild,yes,1,"esbuild bundling, plugins, and build optimization.",C:\Users\Treml\.claude\plugins\marketplaces\a5c.ai\library\specializations\web-development\skills\esbuild\SKILL.md,
escalation-workflow,yes,1,Automated escalation path determination and workflow execution,C:\Users\Treml\.claude\plugins\marketplaces\a5c.ai\library\specializations\domains\business\customer-experience\skills\escalation-workflow\SKILL.md,
escrow-tracker,yes,1,"Tracks escrow releases, holdbacks, earnout milestones",C:\Users\Treml\.claude\plugins\marketplaces\a5c.ai\library\specializations\domains\business\venture-capital\skills\escrow-tracker\SKILL.md,
esg-scorer,yes,1,"ESG rating calculation based on environmental, social, governance metrics",C:\Users\Treml\.claude\plugins\marketplaces\a5c.ai\library\specializations\domains\business\venture-capital\skills\esg-scorer\SKILL.md,
eslint,yes,1,"ESLint configuration, custom rules, and plugin development.",C:\Users\Treml\.claude\plugins\marketplaces\a5c.ai\library\specializations\web-development\skills\eslint\SKILL.md,
ethical-framework-application,yes,1,"Apply multiple ethical frameworks (deontological, consequentialist, virtue ethics, care ethics) systematically to moral problems and generate reasoned recommendations",C:\Users\Treml\.claude\plugins\marketplaces\a5c.ai\library\specializations\domains\social-sciences-humanities\philosophy\skills\ethical-framework-application\SKILL.md,
ethnographic-coding-thematics,yes,1,"Code qualitative field data, identify emergent themes, and develop grounded interpretations using NVivo/Atlas.ti methodologies",C:\Users\Treml\.claude\plugins\marketplaces\a5c.ai\library\specializations\domains\social-sciences-humanities\humanities\skills\ethnographic-coding-thematics\SKILL.md,
ethnographic-research,yes,1,"Conduct participant observation, fieldwork, immersion, and thick description documentation in diverse cultural settings",C:\Users\Treml\.claude\plugins\marketplaces\a5c.ai\library\specializations\domains\social-sciences-humanities\social-sciences\skills\ethnographic-research\SKILL.md,
etl-pipeline-builder,yes,1,"Build and manage ETL pipelines for data migration with transformation, CDC, and monitoring",C:\Users\Treml\.claude\plugins\marketplaces\a5c.ai\library\specializations\code-migration-modernization\skills\etl-pipeline-builder\SKILL.md,
eu-mdr-gspr-mapper,yes,1,EU MDR General Safety and Performance Requirements (GSPR) mapping and compliance documentation skill,C:\Users\Treml\.claude\plugins\marketplaces\a5c.ai\library\specializations\domains\science\biomedical-engineering\skills\eu-mdr-gspr-mapper\SKILL.md,
ev-certificate-validator,yes,1,Validate EV code signing certificate chain and timestamp for Windows SmartScreen,C:\Users\Treml\.claude\plugins\marketplaces\a5c.ai\library\specializations\desktop-development\skills\ev-certificate-validator\SKILL.md,
eva-skill,yes,1,Submit compact EVA REST requests for species metadata and archived variant lookups. Use when a user wants concise European Variation Archive summaries,C:\Users\Treml\.codex\.tmp\plugins\plugins\life-science-research\skills\eva-skill\SKILL.md,
eval-harness,yes,1,"Evaluation harness for testing agent and skill quality through structured benchmarks, regression tests, and quality scoring.",C:\Users\Treml\.claude\plugins\marketplaces\a5c.ai\library\methodologies\everything-claude-code\skills\eval-harness\SKILL.md,
evaluate-plugin,yes,1,"Evaluate a local Codex plugin in engineer-friendly language. Use when the user says ""evaluate this plugin"", ""audit this plugin"", ""why did this score that way"", ""what should I fix first"", ""help me benchmark this plugin"", or asks for a plugin-wide report before comparing versions.",C:\Users\Treml\.codex\.tmp\plugins\plugins\plugin-eval\skills\evaluate-plugin\SKILL.md,
evaluate-skill,yes,1,"Evaluate a local Codex skill in engineer-friendly terms. Use when the user says ""evaluate this skill"", ""give me an analysis of the game dev skill"", ""audit this skill"", ""why did this score that way"", ""what should I fix first"", or asks for a skill-specific report before benchmarking it.",C:\Users\Treml\.codex\.tmp\plugins\plugins\plugin-eval\skills\evaluate-skill\SKILL.md,
event-loop,yes,1,Expert skill for high-performance event-driven I/O programming and optimization,C:\Users\Treml\.claude\plugins\marketplaces\a5c.ai\library\specializations\network-programming\skills\event-loop\SKILL.md,
event-sourcing-migrator,yes,1,"Migrate to event-sourcing architecture with event extraction, store setup, and CQRS implementation",C:\Users\Treml\.claude\plugins\marketplaces\a5c.ai\library\specializations\code-migration-modernization\skills\event-sourcing-migrator\SKILL.md,
evidence-justification-assessment,yes,1,"Evaluate epistemic warrant, assess evidence quality and relevance, apply epistemic standards appropriate to different domains, and identify sources of knowledge",C:\Users\Treml\.claude\plugins\marketplaces\a5c.ai\library\specializations\domains\social-sciences-humanities\philosophy\skills\evidence-justification-assessment\SKILL.md,
evidently-drift-detector,yes,1,"Evidently AI skill for data drift detection, model performance monitoring, target drift analysis, and automated reporting for ML systems in production.",C:\Users\Treml\.claude\plugins\marketplaces\a5c.ai\library\specializations\data-science-ml\skills\evidently-drift-detector\SKILL.md,
evm-analysis,yes,1,"Deep EVM bytecode analysis and decompilation capabilities for smart contract security, gas optimization, and reverse engineering. Provides tools for analyzing opcodes, storage layouts, proxy patterns, and bytecode verification.",C:\Users\Treml\.claude\plugins\marketplaces\a5c.ai\library\specializations\cryptography-blockchain\skills\evm-analysis\SKILL.md,
evm-calculator,yes,1,Automated calculation of all earned value metrics and forecasts,C:\Users\Treml\.claude\plugins\marketplaces\a5c.ai\library\specializations\domains\business\project-management\skills\evm-calculator\SKILL.md,
example-command,yes,1,An example user-invoked skill that demonstrates frontmatter options and the skills/<name>/SKILL.md layout,C:\Users\Treml\.claude\plugins\marketplaces\claude-plugins-official\plugins\example-plugin\skills\example-command\SKILL.md,
example-skill,yes,1,"This skill should be used when the user asks to ""demonstrate skills"", ""show skill format"", ""create a skill template"", or discusses skill development patterns. Provides a reference template for creating Claude Code plugin skills.",C:\Users\Treml\.claude\plugins\marketplaces\claude-plugins-official\plugins\example-plugin\skills\example-skill\SKILL.md,
executing-plans,yes,1,Use when you have a written implementation plan to execute in a separate session with review checkpoints,C:\Users\Treml\.claude\plugins\cache\claude-plugins-official\superpowers\5.1.0\skills\executing-plans\SKILL.md,
executing-plans,yes,1,Use when you have a written implementation plan to execute in a separate session with review checkpoints between batches.,C:\Users\Treml\.claude\plugins\marketplaces\a5c.ai\library\methodologies\superpowers\skills\executing-plans\SKILL.md,
executing-plans,yes,2,Use when you have a written implementation plan to execute in a separate session with review checkpoints,C:\Users\Treml\.codex\.tmp\plugins\plugins\superpowers\skills\executing-plans\SKILL.md,C:\Users\Treml\.codex\plugins\cache\openai-curated\superpowers\1b89ff49\skills\executing-plans\SKILL.md
exhibition-design,yes,1,"Plan and design exhibition layouts including spatial arrangement, object placement, lighting, graphics, and visitor flow optimization for diverse audiences",C:\Users\Treml\.claude\plugins\marketplaces\a5c.ai\library\specializations\domains\social-sciences-humanities\arts-culture\skills\exhibition-design\SKILL.md,
exit-analysis,yes,1,Analyze exit interview data and identify retention insights and patterns,C:\Users\Treml\.claude\plugins\marketplaces\a5c.ai\library\specializations\domains\business\human-resources\skills\exit-analysis\SKILL.md,
exit-readiness-scorer,yes,1,"Scores company readiness across financial, operational, governance dimensions",C:\Users\Treml\.claude\plugins\marketplaces\a5c.ai\library\specializations\domains\business\venture-capital\skills\exit-readiness-scorer\SKILL.md,
experiment-planner-doe,yes,1,Design of Experiments skill for systematic optimization of nanomaterial synthesis and processing,C:\Users\Treml\.claude\plugins\marketplaces\a5c.ai\library\specializations\domains\science\nanotechnology\skills\experiment-planner-doe\SKILL.md,
expo-api-routes,yes,1,Guidelines for creating API routes in Expo Router with EAS Hosting,C:\Users\Treml\.codex\.tmp\plugins\plugins\expo\skills\expo-api-routes\SKILL.md,
expo-cicd-workflows,yes,1,"Helps understand and write EAS workflow YAML files for Expo projects. Use this skill when the user asks about CI/CD or workflows in an Expo or EAS context, mentions .eas/workflows/, or wants help with EAS build pipelines or deployment automation.",C:\Users\Treml\.codex\.tmp\plugins\plugins\expo\skills\expo-cicd-workflows\SKILL.md,
expo-deployment,yes,1,"Deploying Expo apps to iOS App Store, Android Play Store, web hosting, and API routes",C:\Users\Treml\.codex\.tmp\plugins\plugins\expo\skills\expo-deployment\SKILL.md,
expo-dev-client,yes,1,Build and distribute Expo development clients locally or via TestFlight,C:\Users\Treml\.codex\.tmp\plugins\plugins\expo\skills\expo-dev-client\SKILL.md,
expo-module,yes,1,"Guide for writing Expo native modules and views using the Expo Modules API (Swift, Kotlin, TypeScript). Covers module definition DSL, native views, shared objects, config plugins, lifecycle hooks, autolinking, and type system. Use when building or modifying native modules for Expo.",C:\Users\Treml\.codex\.tmp\plugins\plugins\expo\skills\expo-module\SKILL.md,
expo-tailwind-setup,yes,1,Set up Tailwind CSS v4 in Expo with react-native-css and NativeWind v5 for universal styling,C:\Users\Treml\.codex\.tmp\plugins\plugins\expo\skills\expo-tailwind-setup\SKILL.md,
expo-ui-jetpack-compose,yes,1,`@expo/ui/jetpack-compose` package lets you use Jetpack Compose Views and modifiers in your app.,C:\Users\Treml\.codex\.tmp\plugins\plugins\expo\skills\expo-ui-jetpack-compose\SKILL.md,
expo-ui-swift-ui,yes,1,`@expo/ui/swift-ui` package lets you use SwiftUI Views and modifiers in your app.,C:\Users\Treml\.codex\.tmp\plugins\plugins\expo\skills\expo-ui-swift-ui\SKILL.md,
express,yes,1,"Express.js middleware patterns, routing, error handling, security, and production best practices.",C:\Users\Treml\.claude\plugins\marketplaces\a5c.ai\library\specializations\web-development\skills\express\SKILL.md,
external-tool-coordination,yes,1,"Coordinate external AI tool integration (OpenAI Codex, Google Gemini) for cross-model adversarial review and delegated implementation.",C:\Users\Treml\.claude\plugins\marketplaces\a5c.ai\library\methodologies\metaswarm\skills\external-tool-coordination\SKILL.md,
extractables-leachables-analyzer,yes,1,E&L study design and data analysis skill for chemical characterization of medical devices,C:\Users\Treml\.claude\plugins\marketplaces\a5c.ai\library\specializations\domains\science\biomedical-engineering\skills\extractables-leachables-analyzer\SKILL.md,
facial-animation,yes,1,Facial animation skill for blend shapes and lip sync.,C:\Users\Treml\.claude\plugins\marketplaces\a5c.ai\library\specializations\game-development\skills\facial-animation\SKILL.md,
facilitation-workshop-delivery,yes,1,Design and facilitate engaging professional development workshops using adult learning principles and active learning strategies,C:\Users\Treml\.claude\plugins\marketplaces\a5c.ai\library\specializations\domains\social-sciences-humanities\education\skills\facilitation-workshop-delivery\SKILL.md,
facility-layout-optimizer,yes,1,Facility layout optimization skill for material flow minimization and space utilization.,C:\Users\Treml\.claude\plugins\marketplaces\a5c.ai\library\specializations\domains\science\industrial-engineering\skills\facility-layout-optimizer\SKILL.md,
fai-inspection,yes,1,Skill for first article inspection planning and execution per AS9102,C:\Users\Treml\.claude\plugins\marketplaces\a5c.ai\library\specializations\domains\science\mechanical-engineering\skills\fai-inspection\SKILL.md,
failure-analysis,yes,1,Systematic failure analysis methodology for mechanical component failures,C:\Users\Treml\.claude\plugins\marketplaces\a5c.ai\library\specializations\domains\science\mechanical-engineering\skills\failure-analysis\SKILL.md,
fairlearn-bias-detector,yes,1,"Fairness assessment skill using Fairlearn for bias detection, mitigation, and compliance reporting.",C:\Users\Treml\.claude\plugins\marketplaces\a5c.ai\library\specializations\data-science-ml\skills\fairlearn-bias-detector\SKILL.md,
fallacy-detection-analysis,yes,1,"Identify formal and informal logical fallacies in arguments, classify fallacy types, and explain precisely why reasoning fails with reference to logical principles",C:\Users\Treml\.claude\plugins\marketplaces\a5c.ai\library\specializations\domains\social-sciences-humanities\philosophy\skills\fallacy-detection-analysis\SKILL.md,
fastify,yes,1,"Fastify plugins, hooks, validation, serialization, and performance optimization patterns.",C:\Users\Treml\.claude\plugins\marketplaces\a5c.ai\library\specializations\web-development\skills\fastify\SKILL.md,
Fastlane/Mobile CI-CD,yes,1,"Automated mobile build, test, and deployment with Fastlane",C:\Users\Treml\.claude\plugins\marketplaces\a5c.ai\library\specializations\mobile-development\skills\fastlane-cicd\SKILL.md,
fastqc-quality-analyzer,yes,1,"Sequencing quality control skill for assessing read quality, adapter contamination, and sequence composition",C:\Users\Treml\.claude\plugins\marketplaces\a5c.ai\library\specializations\domains\science\bioinformatics\skills\fastqc-quality-analyzer\SKILL.md,
fatigue-analysis,yes,1,Specialized skill for fatigue life assessment and durability prediction under cyclic loading conditions,C:\Users\Treml\.claude\plugins\marketplaces\a5c.ai\library\specializations\domains\science\mechanical-engineering\skills\fatigue-analysis\SKILL.md,
fatigue-dt,yes,1,Specialized skill for fatigue life prediction and damage tolerance assessment,C:\Users\Treml\.claude\plugins\marketplaces\a5c.ai\library\specializations\domains\science\aerospace-engineering\skills\fatigue-dt\SKILL.md,
fatigue-life-predictor,yes,1,Fatigue life prediction skill for implants and load-bearing devices using validated approaches,C:\Users\Treml\.claude\plugins\marketplaces\a5c.ai\library\specializations\domains\science\biomedical-engineering\skills\fatigue-life-predictor\SKILL.md,
fda-510k-submission-generator,yes,1,"Automated 510(k) premarket notification preparation for generating submission packages, predicate device comparisons, and substantial equivalence arguments",C:\Users\Treml\.claude\plugins\marketplaces\a5c.ai\library\specializations\domains\science\biomedical-engineering\skills\fda-510k-submission-generator\SKILL.md,
fea-mesh-generator,yes,1,"Finite element mesh generation skill optimized for biomedical geometries including implants, anatomical structures, and tissue models",C:\Users\Treml\.claude\plugins\marketplaces\a5c.ai\library\specializations\domains\science\biomedical-engineering\skills\fea-mesh-generator\SKILL.md,
fea-structural,yes,1,Expert FEA skill for aerospace structural analysis workflows,C:\Users\Treml\.claude\plugins\marketplaces\a5c.ai\library\specializations\domains\science\aerospace-engineering\skills\fea-structural\SKILL.md,
fea-structural,yes,1,"Deep integration with finite element analysis tools for structural simulation across static, dynamic, and nonlinear domains",C:\Users\Treml\.claude\plugins\marketplaces\a5c.ai\library\specializations\domains\science\mechanical-engineering\skills\fea-structural\SKILL.md,
fea-structural-engine,yes,1,"Finite Element Analysis skill for linear and nonlinear structural analysis, modal analysis, and load combination processing",C:\Users\Treml\.claude\plugins\marketplaces\a5c.ai\library\specializations\domains\science\civil-engineering\skills\fea-structural-engine\SKILL.md,
feast-feature-store,yes,1,"Feature store management skill for online/offline feature serving, feature registration, and training-serving consistency.",C:\Users\Treml\.claude\plugins\marketplaces\a5c.ai\library\specializations\data-science-ml\skills\feast-feature-store\SKILL.md,
Feature Engineering Optimizer,yes,1,Optimizes feature engineering pipelines and feature store configurations,C:\Users\Treml\.claude\plugins\marketplaces\a5c.ai\library\specializations\data-engineering-analytics\skills\feature-engineering-optimizer\SKILL.md,
Feature Flagging,yes,1,Feature flag configuration and rollout planning for controlled releases,C:\Users\Treml\.claude\plugins\marketplaces\a5c.ai\library\specializations\product-management\skills\feature-flags\SKILL.md,
feature-intake,no,1,,C:\Users\Treml\.claude\plugins\marketplaces\a5c.ai\library\methodologies\automaker\skills\feature-intake\SKILL.md,
few-shot-example-gen,yes,1,Few-shot example generation and optimization for improved LLM performance,C:\Users\Treml\.claude\plugins\marketplaces\a5c.ai\library\specializations\ai-agents-conversational\skills\few-shot-example-gen\SKILL.md,
FFI Design,yes,1,Expert skill for designing and implementing foreign function interfaces to native code,C:\Users\Treml\.claude\plugins\marketplaces\a5c.ai\library\specializations\programming-languages\skills\ffi-design\SKILL.md,
fib-mill-controller,yes,1,Focused Ion Beam milling skill for site-specific nanofabrication and cross-section preparation,C:\Users\Treml\.claude\plugins\marketplaces\a5c.ai\library\specializations\domains\science\nanotechnology\skills\fib-mill-controller\SKILL.md,
fifo-lifo-controller,yes,1,"Automated inventory rotation management skill ensuring proper product flow based on expiration, production, or receipt dates",C:\Users\Treml\.claude\plugins\marketplaces\a5c.ai\library\specializations\domains\business\logistics\skills\fifo-lifo-controller\SKILL.md,
figma,yes,1,"Use the Figma MCP server to fetch design context, screenshots, variables, and assets from Figma, and to translate Figma nodes into production code. Trigger when a task involves Figma URLs, node IDs, design-to-code implementation, or Figma MCP setup and troubleshooting.",C:\Users\Treml\.codex\vendor_imports\skills\skills\.curated\figma\SKILL.md,
figma-api,yes,1,"Direct Figma API interactions for design asset management. Fetch files and components, extract design tokens, export images, manage comments, and access version history.",C:\Users\Treml\.claude\plugins\marketplaces\a5c.ai\library\specializations\ux-ui-design\skills\figma-api\SKILL.md,
figma-code-connect,yes,1,"Creates and maintains Figma Code Connect template files that map Figma components to code snippets. Use when the user mentions Code Connect, Figma component mapping, design-to-code translation, or asks to create/update .figma.ts or .figma.js files.",C:\Users\Treml\.codex\.tmp\plugins\plugins\figma\skills\figma-code-connect\SKILL.md,
figma-code-connect-components,yes,1,"Connects Figma design components to code components using Code Connect mapping tools. Use when user says ""code connect"", ""connect this component to code"", ""map this component"", ""link component to code"", ""create code connect mapping"", or wants to establish mappings between Figma designs and code implementations. For canvas writes via `use_figma`, use `figma-use`.",C:\Users\Treml\.codex\vendor_imports\skills\skills\.curated\figma-code-connect-components\SKILL.md,
figma-create-design-system-rules,yes,1,"Generates custom design system rules for the user's codebase. Use when user says ""create design system rules"", ""generate rules for my project"", ""set up design rules"", ""customize design system guidelines"", or wants to establish project-specific conventions for Figma-to-code workflows. Requires Figma MCP server connection.",C:\Users\Treml\.codex\vendor_imports\skills\skills\.curated\figma-create-design-system-rules\SKILL.md,
figma-create-new-file,yes,1,"**MANDATORY prerequisite** — you MUST invoke this skill BEFORE every `create_new_file` tool call. NEVER call `create_new_file` directly without loading this skill first. Trigger whenever the user wants a new blank Figma file — a new design, FigJam, or Slides file — or when you need a fresh file before calling `use_figma`. Usage — /figma-create-new-file [editorType] [fileName] (e.g. /figma-create-new-file figjam My Whiteboard, /figma-create-new-file slides Q3 Review)",C:\Users\Treml\.codex\.tmp\plugins\plugins\figma\skills\figma-create-new-file\SKILL.md,
