name,has_yaml,copies,description,kept_source_path,other_copy_paths
runtime-cache,yes,1,"Vercel Runtime Cache API guidance — ephemeral per-region key-value cache with tag-based invalidation. Shared across Functions, Routing Middleware, and Builds. Use when implementing caching strategies beyond framework-level caching.",C:\Users\Treml\.codex\.tmp\plugins\plugins\vercel\skills\runtime-cache\SKILL.md,
rust-sdk-specialist,yes,1,Rust SDK development with zero-cost abstractions,C:\Users\Treml\.claude\plugins\marketplaces\a5c.ai\library\specializations\sdk-platform-development\skills\rust-sdk-specialist\SKILL.md,
RViz Visualization Skill,yes,1,RViz configuration and custom visualization for robot development and debugging,C:\Users\Treml\.claude\plugins\marketplaces\a5c.ai\library\specializations\robotics-simulation\skills\rviz-visualization\SKILL.md,
rxjs,yes,1,"RxJS reactive programming patterns including operators, error handling, multicasting, and Angular integration.",C:\Users\Treml\.claude\plugins\marketplaces\a5c.ai\library\specializations\web-development\skills\rxjs\SKILL.md,
Safety System Skill,yes,1,Robot safety system design and validation for industrial and collaborative robots,C:\Users\Treml\.claude\plugins\marketplaces\a5c.ai\library\specializations\robotics-simulation\skills\safety-systems\SKILL.md,
safety-assessment,yes,1,Skill for structured safety assessment following ARP4761 guidelines,C:\Users\Treml\.claude\plugins\marketplaces\a5c.ai\library\specializations\domains\science\aerospace-engineering\skills\safety-assessment\SKILL.md,
safety-stock-calculator,yes,1,"Dynamic safety stock and reorder point optimization skill based on demand variability, lead times, and service level targets",C:\Users\Treml\.claude\plugins\marketplaces\a5c.ai\library\specializations\domains\business\logistics\skills\safety-stock-calculator\SKILL.md,
safety-stock-calculator,yes,1,Statistical safety stock calculation skill with service level targeting and variability analysis,C:\Users\Treml\.claude\plugins\marketplaces\a5c.ai\library\specializations\domains\business\supply-chain\skills\safety-stock-calculator\SKILL.md,
sage-math-interface,yes,1,SageMath for comprehensive mathematical computation,C:\Users\Treml\.claude\plugins\marketplaces\a5c.ai\library\specializations\domains\science\mathematics\skills\sage-math-interface\SKILL.md,
salesforce-connector,yes,1,Bi-directional Salesforce CRM integration for sales data management,C:\Users\Treml\.claude\plugins\marketplaces\a5c.ai\library\specializations\domains\business\sales\skills\salesforce-connector\SKILL.md,
salesloft-cadences,yes,1,SalesLoft cadence and sales engagement integration,C:\Users\Treml\.claude\plugins\marketplaces\a5c.ai\library\specializations\domains\business\sales\skills\salesloft-cadences\SKILL.md,
salmon-quantifier,yes,1,Salmon pseudo-alignment skill for fast and accurate transcript quantification,C:\Users\Treml\.claude\plugins\marketplaces\a5c.ai\library\specializations\domains\science\bioinformatics\skills\salmon-quantifier\SKILL.md,
samtools-bam-processor,yes,1,"BAM/SAM file manipulation skill for sorting, indexing, filtering, and extracting alignment data",C:\Users\Treml\.claude\plugins\marketplaces\a5c.ai\library\specializations\domains\science\bioinformatics\skills\samtools-bam-processor\SKILL.md,
sandbox-entitlements-auditor,yes,1,Audit and recommend minimal sandbox entitlements for secure desktop applications,C:\Users\Treml\.claude\plugins\marketplaces\a5c.ai\library\specializations\desktop-development\skills\sandbox-entitlements-auditor\SKILL.md,
sandbox-sdk,yes,1,"Build sandboxed applications for secure code execution. Load when building AI code execution, code interpreters, CI/CD systems, interactive dev environments, or executing untrusted code. Covers Sandbox SDK lifecycle, commands, files, code interpreter, and preview URLs. Biases towards retrieval from Cloudflare docs over pre-trained knowledge.",C:\Users\Treml\.codex\.tmp\plugins\plugins\cloudflare\skills\sandbox-sdk\SKILL.md,
sast-analyzer,yes,1,"Static Application Security Testing orchestration and analysis. Execute Semgrep, Bandit, ESLint security plugins, CodeQL, and other SAST tools. Parse, prioritize, and deduplicate findings across multiple tools with remediation guidance.",C:\Users\Treml\.claude\plugins\marketplaces\a5c.ai\library\specializations\security-compliance\skills\sast-analyzer\SKILL.md,
satori,yes,1,"Expert guidance for Satori — Vercel's library that converts HTML and CSS to SVG, commonly used to generate dynamic OG images for Next.js and other frameworks.",C:\Users\Treml\.codex\.tmp\plugins\plugins\vercel\skills\satori\SKILL.md,
saxs-waxs-analyzer,yes,1,"Small/Wide Angle X-ray Scattering skill for nanostructure size, shape, and organization analysis",C:\Users\Treml\.claude\plugins\marketplaces\a5c.ai\library\specializations\domains\science\nanotechnology\skills\saxs-waxs-analyzer\SKILL.md,
scaffold-design-optimizer,yes,1,"Tissue engineering scaffold design optimization skill for pore size, porosity, and mechanical properties",C:\Users\Treml\.claude\plugins\marketplaces\a5c.ai\library\specializations\domains\science\biomedical-engineering\skills\scaffold-design-optimizer\SKILL.md,
scale-up-analyzer,yes,1,"Process scale-up analysis skill for dimensional analysis, similarity criteria, and pilot-to-production transitions",C:\Users\Treml\.claude\plugins\marketplaces\a5c.ai\library\specializations\domains\science\chemical-engineering\skills\scale-up-analyzer\SKILL.md,
scale-up-process-analyzer,yes,1,Process engineering skill for analyzing and optimizing nanomaterial synthesis scale-up from lab to production,C:\Users\Treml\.claude\plugins\marketplaces\a5c.ai\library\specializations\domains\science\nanotechnology\skills\scale-up-process-analyzer\SKILL.md,
SCD Implementation Generator,yes,1,Generates Slowly Changing Dimension implementations across platforms,C:\Users\Treml\.claude\plugins\marketplaces\a5c.ai\library\specializations\data-engineering-analytics\skills\scd-implementation-generator\SKILL.md,
scenario-modeler,yes,1,"Monte Carlo simulations for exit scenarios, return distributions",C:\Users\Treml\.claude\plugins\marketplaces\a5c.ai\library\specializations\domains\business\venture-capital\skills\scenario-modeler\SKILL.md,
scenario-narrative-generator,yes,1,"Scenario narrative generation skill for creating vivid, consistent future scenario descriptions",C:\Users\Treml\.claude\plugins\marketplaces\a5c.ai\library\specializations\domains\business\decision-intelligence\skills\scenario-narrative-generator\SKILL.md,
scenario-simulation,yes,1,Scenario-based simulation for ADAS/AD validation,C:\Users\Treml\.claude\plugins\marketplaces\a5c.ai\library\specializations\domains\science\automotive-engineering\skills\scenario-simulation\SKILL.md,
scene-writing,yes,1,"Write individual screenplay scenes with proper industry formatting, visual action, and dramatic structure",C:\Users\Treml\.claude\plugins\marketplaces\a5c.ai\library\specializations\domains\social-sciences-humanities\arts-culture\film-tv-production\skills\scene-writing\SKILL.md,
Schema Evolution Manager,yes,1,Manages schema evolution and compatibility across data systems,C:\Users\Treml\.claude\plugins\marketplaces\a5c.ai\library\specializations\data-engineering-analytics\skills\schema-evolution-manager\SKILL.md,
schema-comparator,yes,1,Compare database schemas between source and target environments for migration planning,C:\Users\Treml\.claude\plugins\marketplaces\a5c.ai\library\specializations\code-migration-modernization\skills\schema-comparator\SKILL.md,
scholarly-literature-synthesis,yes,1,"Survey, analyze, and synthesize philosophical literature on topics, identify major positions, trace debates, and locate gaps in scholarly discourse",C:\Users\Treml\.claude\plugins\marketplaces\a5c.ai\library\specializations\domains\social-sciences-humanities\philosophy\skills\scholarly-literature-synthesis\SKILL.md,
scientific-figure-generator,yes,1,Skill for generating publication-quality scientific figures,C:\Users\Treml\.claude\plugins\marketplaces\a5c.ai\library\specializations\domains\science\scientific-discovery\skills\scientific-figure-generator\SKILL.md,
scikit-hep-analysis,yes,1,Scikit-HEP toolkit skill for particle physics data analysis with modern Python tools,C:\Users\Treml\.claude\plugins\marketplaces\a5c.ai\library\specializations\domains\science\physics\skills\scikit-hep-analysis\SKILL.md,
scipy-optimization-toolkit,yes,1,"SciPy scientific computing skill for numerical optimization, integration, and signal processing in physics",C:\Users\Treml\.claude\plugins\marketplaces\a5c.ai\library\specializations\domains\science\physics\skills\scipy-optimization-toolkit\SKILL.md,
scoop-manifest-generator,yes,1,Generate Scoop manifest for Windows CLI distribution.,C:\Users\Treml\.claude\plugins\marketplaces\a5c.ai\library\specializations\cli-mcp-development\skills\scoop-manifest-generator\SKILL.md,
scope-logic-analyzer,yes,1,Test equipment integration for signal analysis (oscilloscope and logic analyzer),C:\Users\Treml\.claude\plugins\marketplaces\a5c.ai\library\specializations\embedded-systems\skills\scope-logic-analyzer\SKILL.md,
scope-permission-designer,yes,1,Design and implement scoped permission models,C:\Users\Treml\.claude\plugins\marketplaces\a5c.ai\library\specializations\sdk-platform-development\skills\scope-permission-designer\SKILL.md,
scor-kpi-dashboard-builder,yes,1,SCOR-aligned supply chain KPI dashboard design and implementation skill,C:\Users\Treml\.claude\plugins\marketplaces\a5c.ai\library\specializations\domains\business\supply-chain\skills\scor-kpi-dashboard-builder\SKILL.md,
screen-capture-api,yes,1,Cross-platform screen and window capture for screenshots and recording,C:\Users\Treml\.claude\plugins\marketplaces\a5c.ai\library\specializations\desktop-development\skills\screen-capture-api\SKILL.md,
screen-effects,yes,1,Full-screen effect skill for damage indicators.,C:\Users\Treml\.claude\plugins\marketplaces\a5c.ai\library\specializations\game-development\skills\screen-effects\SKILL.md,
screen-reader,yes,1,"Screen reader compatibility, testing, and optimization.",C:\Users\Treml\.claude\plugins\marketplaces\a5c.ai\library\specializations\web-development\skills\screen-reader\SKILL.md,
screenplay-formatting,yes,1,Format screenplays to industry standard using Fountain markup for professional presentation,C:\Users\Treml\.claude\plugins\marketplaces\a5c.ai\library\specializations\domains\social-sciences-humanities\arts-culture\film-tv-production\skills\screenplay-formatting\SKILL.md,
screenshot,yes,1,"Use when the user explicitly asks for a desktop or system screenshot (full screen, specific app or window, or a pixel region), or when tool-specific capture capabilities are unavailable and an OS-level capture is needed.",C:\Users\Treml\.codex\vendor_imports\skills\skills\.curated\screenshot\SKILL.md,
screenshot-comparison,yes,1,"Visual regression testing through screenshot capture and comparison. Pixel-diff analysis, responsive screenshot capture across viewports, and visual change reporting with highlighted differences.",C:\Users\Treml\.claude\plugins\marketplaces\a5c.ai\library\specializations\ux-ui-design\skills\screenshot-comparison\SKILL.md,
sdk-init-generator,yes,1,Generate SDK initialization wizards and scaffolding,C:\Users\Treml\.claude\plugins\marketplaces\a5c.ai\library\specializations\sdk-platform-development\skills\sdk-init-generator\SKILL.md,
sdk-mock-generator,yes,1,Generate mock servers and clients for SDK testing,C:\Users\Treml\.claude\plugins\marketplaces\a5c.ai\library\specializations\sdk-platform-development\skills\sdk-mock-generator\SKILL.md,
search-company-knowledge,yes,1,"Search across company knowledge bases (Confluence, Jira, internal docs) to find and explain internal concepts, processes, and technical details. When an agent needs to: (1) Find or search for information about systems, terminology, processes, deployment, authentication, infrastructure, architecture, or technical concepts, (2) Search internal documentation, knowledge base, company docs, or our docs, (3) Explain what something is, how it works, or look up information, or (4) Synthesize information from multiple sources. Searches in parallel and provides cited answers.",C:\Users\Treml\.codex\.tmp\plugins\plugins\atlassian-rovo\skills\search-company-knowledge\SKILL.md,
secret-detection-scanner,yes,1,"Detect secrets, credentials, and sensitive data in code and configurations. Scan git history for secrets, detect API keys, tokens, passwords, check environment files, monitor CI/CD logs for exposure, generate remediation steps, and track secret rotation status.",C:\Users\Treml\.claude\plugins\marketplaces\a5c.ai\library\specializations\security-compliance\skills\secret-detection-scanner\SKILL.md,
secrets-management,yes,1,"Enterprise secrets management across platforms. Manage secrets with HashiCorp Vault, AWS Secrets Manager, Azure Key Vault, GCP Secret Manager, and Kubernetes secrets. Configure rotation, policies, and access controls.",C:\Users\Treml\.claude\plugins\marketplaces\a5c.ai\library\specializations\devops-sre-platform\skills\secrets-management\SKILL.md,
secrets-management,yes,1,"Secrets handling, environment variables, and vault integration.",C:\Users\Treml\.claude\plugins\marketplaces\a5c.ai\library\specializations\web-development\skills\secrets-management\SKILL.md,
section-property-calculator,yes,1,Cross-sectional property calculation skill for structural sections including standard and custom shapes,C:\Users\Treml\.claude\plugins\marketplaces\a5c.ai\library\specializations\domains\science\civil-engineering\skills\section-property-calculator\SKILL.md,
secure-coding-training-skill,yes,1,Developer security training and assessment for secure coding practices and vulnerability prevention,C:\Users\Treml\.claude\plugins\marketplaces\a5c.ai\library\specializations\security-compliance\skills\secure-coding-training-skill\SKILL.md,
security-best-practices,yes,1,"Perform language and framework specific security best-practice reviews and suggest improvements. Trigger only when the user explicitly requests security best practices guidance, a security review/report, or secure-by-default coding help. Trigger only for supported languages (python, javascript/typescript, go). Do not trigger for general code review, debugging, or non-security tasks.",C:\Users\Treml\.codex\vendor_imports\skills\skills\.curated\security-best-practices\SKILL.md,
security-hardening,yes,1,"AIDefence security layer with prompt injection blocking, input validation, sandboxed execution, output sanitization, and STRIDE threat modeling.",C:\Users\Treml\.claude\plugins\marketplaces\a5c.ai\library\methodologies\ruflo\skills\security-hardening\SKILL.md,
security-ownership-map,yes,1,"Analyze git repositories to build a security ownership topology (people-to-file), compute bus factor and sensitive-code ownership, and export CSV/JSON for graph databases and visualization. Trigger only when the user explicitly wants a security-oriented ownership or bus-factor analysis grounded in git history (for example: orphaned sensitive code, security maintainers, CODEOWNERS reality checks for risk, sensitive hotspots, or ownership clusters). Do not trigger for general maintainer lists or non-security ownership questions.",C:\Users\Treml\.codex\vendor_imports\skills\skills\.curated\security-ownership-map\SKILL.md,
security-review,yes,1,"Security vulnerability assessment identifying OWASP risks, injection vectors, authentication issues, and data exposure with severity classification.",C:\Users\Treml\.claude\plugins\marketplaces\a5c.ai\library\methodologies\rpikit\skills\security-review\SKILL.md,
security-sandbox,yes,1,"Isolated analysis environment management for malware and exploit testing. Create and manage isolated VMs, configure Cuckoo Sandbox, set up REMnux/FlareVM environments, manage Docker-based analysis containers, and capture filesystem and process changes.",C:\Users\Treml\.claude\plugins\marketplaces\a5c.ai\library\specializations\security-research\skills\security-sandbox\SKILL.md,
security-scan,yes,1,"Use when the user asks for a full security scan or security code review of a pull request, commit, branch, patch, working-tree diff, or repository. Run distinct phases: threat modeling, finding discovery, validation, attack-path analysis, and final markdown output.",C:\Users\Treml\.codex\.tmp\plugins\plugins\codex-security\skills\security-scan\SKILL.md,
security-scanner,yes,1,"Run security scans including SAST, dependency scanning, and secret detection",C:\Users\Treml\.claude\plugins\marketplaces\a5c.ai\library\specializations\software-architecture\skills\security-scanner\SKILL.md,
security-scanning,yes,1,"AgentShield security audit with 5 scanning categories, 102 static analysis rules, and optional red-team simulation.",C:\Users\Treml\.claude\plugins\marketplaces\a5c.ai\library\methodologies\everything-claude-code\skills\security-scanning\SKILL.md,
security-threat-model,yes,1,"Repository-grounded threat modeling that enumerates trust boundaries, assets, attacker capabilities, abuse paths, and mitigations, and writes a concise Markdown threat model. Trigger only when the user explicitly asks to threat model a codebase or path, enumerate threats/abuse paths, or perform AppSec threat modeling. Do not trigger for general architecture summaries, code review, or non-security design work.",C:\Users\Treml\.codex\vendor_imports\skills\skills\.curated\security-threat-model\SKILL.md,
segment-tree-builder,yes,1,Generate customized segment tree implementations,C:\Users\Treml\.claude\plugins\marketplaces\a5c.ai\library\specializations\algorithms-optimization\skills\segment-tree-builder\SKILL.md,
seismic-enablement,yes,1,Seismic sales enablement platform for content and learning,C:\Users\Treml\.claude\plugins\marketplaces\a5c.ai\library\specializations\domains\business\sales\skills\seismic-enablement\SKILL.md,
seismic-hazard-analyzer,yes,1,"Seismic hazard analysis skill for site classification, spectral acceleration, and design response spectrum generation",C:\Users\Treml\.claude\plugins\marketplaces\a5c.ai\library\specializations\domains\science\civil-engineering\skills\seismic-hazard-analyzer\SKILL.md,
seldon-model-deployer,yes,1,"Seldon Core deployment skill for model serving, A/B testing, and canary deployments on Kubernetes.",C:\Users\Treml\.claude\plugins\marketplaces\a5c.ai\library\specializations\data-science-ml\skills\seldon-model-deployer\SKILL.md,
Selenium WebDriver,yes,1,Selenium WebDriver expertise for cross-browser automation and legacy system testing,C:\Users\Treml\.claude\plugins\marketplaces\a5c.ai\library\specializations\qa-testing-automation\skills\selenium-webdriver\SKILL.md,
self-optimization,yes,1,"SONA self-optimizing neural architecture with ReasoningBank trajectory learning, EWC++ anti-forgetting, and reinforcement learning feedback loops.",C:\Users\Treml\.claude\plugins\marketplaces\a5c.ai\library\methodologies\ruflo\skills\self-optimization\SKILL.md,
sem-eds-analyzer,yes,1,Scanning Electron Microscopy with Energy Dispersive X-ray Spectroscopy skill for morphology and elemental analysis,C:\Users\Treml\.claude\plugins\marketplaces\a5c.ai\library\specializations\domains\science\nanotechnology\skills\sem-eds-analyzer\SKILL.md,
semantic-code-analyzer,yes,1,LLM-powered semantic analysis of code diffs to detect business-logic trojans,C:\Users\Treml\.claude\plugins\marketplaces\a5c.ai\library\specializations\security-compliance\skills\semantic-code-analyzer\SKILL.md,
semantic-kernel-setup,yes,1,Microsoft Semantic Kernel planner and plugin setup for orchestrated AI,C:\Users\Treml\.claude\plugins\marketplaces\a5c.ai\library\specializations\ai-agents-conversational\skills\semantic-kernel-setup\SKILL.md,
semantic-scholar-search,yes,1,Academic literature search using Semantic Scholar API for citation-aware paper discovery,C:\Users\Treml\.claude\plugins\marketplaces\a5c.ai\library\specializations\domains\science\scientific-discovery\skills\semantic-scholar-search\SKILL.md,
semantic-similarity,yes,1,Semantic similarity computation for content relationships and intelligent discovery,C:\Users\Treml\.claude\plugins\marketplaces\a5c.ai\library\specializations\domains\business\knowledge-management\skills\semantic-similarity\SKILL.md,
semver-analyzer,yes,1,"Analyze code changes and determine semantic version bumps. Detect breaking changes automatically, suggest version bump (major/minor/patch), generate changelog entries, and validate version consistency.",C:\Users\Treml\.claude\plugins\marketplaces\a5c.ai\library\specializations\sdk-platform-development\skills\semver-analyzer\SKILL.md,
send-request,yes,1,"Send HTTP requests using Postman CLI - use when user says ""send request"", ""test endpoint"", ""call API"", ""hit the endpoint"", ""make a request"", ""try the API"", or wants to quickly test an HTTP endpoint",C:\Users\Treml\.claude\plugins\cache\claude-plugins-official\postman\1.0.0\skills\send-request\SKILL.md,
sensitivity-analysis-toolkit,yes,1,Comprehensive sensitivity analysis for optimization,C:\Users\Treml\.claude\plugins\marketplaces\a5c.ai\library\specializations\domains\science\mathematics\skills\sensitivity-analysis-toolkit\SKILL.md,
sensitivity-analysis-uq,yes,1,Global sensitivity analysis methods,C:\Users\Treml\.claude\plugins\marketplaces\a5c.ai\library\specializations\domains\science\mathematics\skills\sensitivity-analysis-uq\SKILL.md,
sensitivity-analyzer,yes,1,Sensitivity analysis skill for identifying critical inputs and understanding model behavior under uncertainty,C:\Users\Treml\.claude\plugins\marketplaces\a5c.ai\library\specializations\domains\business\decision-intelligence\skills\sensitivity-analyzer\SKILL.md,
sensor-fusion,yes,1,Multi-sensor fusion algorithms for perception in autonomous driving,C:\Users\Treml\.claude\plugins\marketplaces\a5c.ai\library\specializations\domains\science\automotive-engineering\skills\sensor-fusion\SKILL.md,
sensor-fusion,yes,1,"Expert skill for multi-sensor fusion and state estimation using Kalman filtering. Implement EKF/UKF, configure robot_localization, fuse IMU, GPS, odometry, and visual sensors for robust localization.",C:\Users\Treml\.claude\plugins\marketplaces\a5c.ai\library\specializations\robotics-simulation\skills\sensor-fusion\SKILL.md,
sentry,yes,1,"Use when the user asks to inspect Sentry issues or events, summarize recent production errors, or pull basic Sentry health data via the Sentry API; perform read-only queries with the bundled script and require `SENTRY_AUTH_TOKEN`.",C:\Users\Treml\.codex\.tmp\plugins\plugins\sentry\skills\sentry\SKILL.md,
sentry,yes,1,"Use when the user asks to inspect Sentry issues or events, summarize recent production errors, or pull basic Sentry health data via the Sentry CLI; perform read-only queries using the `sentry` command.",C:\Users\Treml\.codex\vendor_imports\skills\skills\.curated\sentry\SKILL.md,
sentry-desktop-setup,yes,1,"Configure Sentry for comprehensive desktop application crash reporting, error monitoring, performance tracking, and release health for Electron and native desktop apps",C:\Users\Treml\.claude\plugins\marketplaces\a5c.ai\library\specializations\desktop-development\skills\sentry-desktop-setup\SKILL.md,
seo,yes,1,"Technical SEO, structured data, sitemaps, and meta tags.",C:\Users\Treml\.claude\plugins\marketplaces\a5c.ai\library\specializations\web-development\skills\seo\SKILL.md,
seo-tools,yes,1,Integration with major SEO platforms and tools,C:\Users\Treml\.claude\plugins\marketplaces\a5c.ai\library\specializations\domains\business\marketing\skills\seo-tools\SKILL.md,
separation-sequence-synthesizer,yes,1,Separation train synthesis skill for optimal sequencing and technology selection,C:\Users\Treml\.claude\plugins\marketplaces\a5c.ai\library\specializations\domains\science\chemical-engineering\skills\separation-sequence-synthesizer\SKILL.md,
serialization,yes,1,"Expert skill for binary and text serialization formats, schema design, and optimization",C:\Users\Treml\.claude\plugins\marketplaces\a5c.ai\library\specializations\network-programming\skills\serialization\SKILL.md,
service-mesh,yes,1,"Service mesh configuration and operations expertise for Istio, Linkerd, and Consul Connect",C:\Users\Treml\.claude\plugins\marketplaces\a5c.ai\library\specializations\devops-sre-platform\skills\service-mesh\SKILL.md,
session-management,yes,1,"Manage agent sessions including initialization, handoffs, revival (seance), and persistent identity for Polecats and Crew agents.",C:\Users\Treml\.claude\plugins\marketplaces\a5c.ai\library\methodologies\gastown\skills\session-management\SKILL.md,
session-memory,yes,1,Mandatory memory persistence system across session resets using three markdown surfaces in .claude/cc10x/. Iron law - every workflow must load at start and update at end.,C:\Users\Treml\.claude\plugins\marketplaces\a5c.ai\library\methodologies\cc10x\skills\session-memory\SKILL.md,
session-recovery,no,1,,C:\Users\Treml\.claude\plugins\marketplaces\a5c.ai\library\methodologies\planning-with-files\skills\session-recovery\SKILL.md,
session-report,yes,1,"Generate an explorable HTML report of Claude Code session usage (tokens, cache, subagents, skills, expensive prompts) from ~/.claude/projects transcripts.",C:\Users\Treml\.claude\plugins\marketplaces\claude-plugins-official\plugins\session-report\skills\session-report\SKILL.md,
setfit-few-shot,yes,1,SetFit few-shot learning for efficient intent classification with minimal data,C:\Users\Treml\.claude\plugins\marketplaces\a5c.ai\library\specializations\ai-agents-conversational\skills\setfit-few-shot\SKILL.md,
settlement-calculator,yes,1,"Foundation settlement calculation skill for immediate, consolidation, and secondary compression",C:\Users\Treml\.claude\plugins\marketplaces\a5c.ai\library\specializations\domains\science\civil-engineering\skills\settlement-calculator\SKILL.md,
