name,has_yaml,copies,description,kept_source_path,other_copy_paths
memory-summarization,yes,1,Conversation summarization for memory compression and context management,C:\Users\Treml\.claude\plugins\marketplaces\a5c.ai\library\specializations\ai-agents-conversational\skills\memory-summarization\SKILL.md,
menu-systems,yes,1,Menu skill for navigation and settings.,C:\Users\Treml\.claude\plugins\marketplaces\a5c.ai\library\specializations\game-development\skills\menu-systems\SKILL.md,
merge-queue,yes,1,"Process the Refinery merge queue - collect agent work, detect and resolve conflicts, merge in dependency order, and verify integration.",C:\Users\Treml\.claude\plugins\marketplaces\a5c.ai\library\methodologies\gastown\skills\merge-queue\SKILL.md,
merger-model-builder,yes,1,M&A merger model construction skill with accretion/dilution analysis and synergy modeling,C:\Users\Treml\.claude\plugins\marketplaces\a5c.ai\library\specializations\domains\business\finance-accounting\skills\merger-model-builder\SKILL.md,
mermaid-renderer,yes,1,Render Mermaid diagrams to images with theme customization and Markdown integration,C:\Users\Treml\.claude\plugins\marketplaces\a5c.ai\library\specializations\software-architecture\skills\mermaid-renderer\SKILL.md,
meta-analysis-engine,yes,1,Skill for conducting meta-analyses of research findings,C:\Users\Treml\.claude\plugins\marketplaces\a5c.ai\library\specializations\domains\science\scientific-discovery\skills\meta-analysis-engine\SKILL.md,
metabolights-skill,yes,1,Submit compact MetaboLights requests for study discovery and study-level metabolomics metadata. Use when a user wants concise MetaboLights summaries,C:\Users\Treml\.codex\.tmp\plugins\plugins\life-science-research\skills\metabolights-skill\SKILL.md,
metadata-standards-implementation,yes,1,"Apply Dublin Core, METS, MODS, and other metadata schemas for digital collections and archival materials",C:\Users\Treml\.claude\plugins\marketplaces\a5c.ai\library\specializations\domains\social-sciences-humanities\humanities\skills\metadata-standards-implementation\SKILL.md,
metallurgical-analysis,yes,1,"Specialized skill for metallic materials analysis and metallography including grain size measurement, phase quantification, and inclusion rating",C:\Users\Treml\.claude\plugins\marketplaces\a5c.ai\library\specializations\domains\science\materials-science\skills\metallurgical-analysis\SKILL.md,
metaphlan-profiler,yes,1,MetaPhlAn metagenomic profiling skill for species-level community composition,C:\Users\Treml\.claude\plugins\marketplaces\a5c.ai\library\specializations\domains\science\bioinformatics\skills\metaphlan-profiler\SKILL.md,
metric-pack-designer,yes,1,Design custom metric packs for plugin-eval so teams can add local evaluation rubrics that emit schema-compatible checks and metrics. Use when the user wants their own evaluation criteria or visualizations.,C:\Users\Treml\.codex\.tmp\plugins\plugins\plugin-eval\skills\metric-pack-designer\SKILL.md,
metrics-dashboard-designer,yes,1,Design KPI dashboards and tracking mechanisms for performance measurement and reporting,C:\Users\Treml\.claude\plugins\marketplaces\a5c.ai\library\specializations\domains\business\business-analysis\skills\metrics-dashboard-designer\SKILL.md,
metrics-schema-generator,yes,1,"Generate metrics schemas for Prometheus, OpenTelemetry, and Grafana dashboards",C:\Users\Treml\.claude\plugins\marketplaces\a5c.ai\library\specializations\software-architecture\skills\metrics-schema-generator\SKILL.md,
mgnify-skill,yes,1,"Submit compact MGnify API requests for microbiome studies, samples, and biome metadata. Use when a user wants concise MGnify summaries",C:\Users\Treml\.codex\.tmp\plugins\plugins\life-science-research\skills\mgnify-skill\SKILL.md,
micro,yes,1,"Expert guidance for micro — asynchronous HTTP microservices framework by Vercel. Use when building lightweight HTTP servers, API endpoints, or microservices using the micro library.",C:\Users\Treml\.codex\.tmp\plugins\plugins\vercel\skills\micro\SKILL.md,
micro-optimizer,yes,1,Apply language-specific micro-optimizations,C:\Users\Treml\.claude\plugins\marketplaces\a5c.ai\library\specializations\algorithms-optimization\skills\micro-optimizer\SKILL.md,
microsoft-code-reference,yes,1,"Find working code samples, verify API signatures, and fix Microsoft SDK errors using official docs. Use whenever the user is writing, debugging, or reviewing code that touches any Microsoft SDK, .NET library, Azure client library, or Microsoft API—even if they don't ask for a ""reference."" Catches hallucinated methods, wrong signatures, and deprecated patterns. If the task involves producing or fixing Microsoft-related code, this is the right skill.",C:\Users\Treml\.claude\plugins\cache\claude-plugins-official\microsoft-docs\0.3.1\skills\microsoft-code-reference\SKILL.md,
microsoft-docs,yes,1,"Understand Microsoft technologies by querying official documentation. Use whenever the user asks how something works, wants tutorials, needs configuration options, limits, quotas, or best practices for any Microsoft technology (Azure, .NET, M365, Windows, Power Platform, etc.)—even if they don't mention ""docs."" If the question is about understanding a concept rather than writing code, this is the right skill.",C:\Users\Treml\.claude\plugins\cache\claude-plugins-official\microsoft-docs\0.3.1\skills\microsoft-docs\SKILL.md,
microsoft-skill-creator,yes,1,"Create agent skills for Microsoft technologies using official documentation. Use whenever the user wants to build, generate, or scaffold a skill for any Microsoft technology (Azure, .NET, M365, VS Code, Bicep, etc.)—even phrased casually like ""make a skill for Cosmos DB."" Investigates the topic via official docs, then generates a hybrid skill with essential knowledge stored locally and dynamic lookups for depth.",C:\Users\Treml\.claude\plugins\cache\claude-plugins-official\microsoft-docs\0.3.1\skills\microsoft-skill-creator\SKILL.md,
middleware-chain-designer,yes,1,Design middleware and interceptor chains for SDK extensibility,C:\Users\Treml\.claude\plugins\marketplaces\a5c.ai\library\specializations\sdk-platform-development\skills\middleware-chain-designer\SKILL.md,
migrate-to-codex,yes,1,"Migrate supported instruction files, skills, agents, and MCP config into Codex project and global files.",C:\Users\Treml\.codex\vendor_imports\skills\skills\.curated\migrate-to-codex\SKILL.md,
migration-validator,yes,1,Validate functional equivalence after migration with side-by-side comparison and behavioral verification,C:\Users\Treml\.claude\plugins\marketplaces\a5c.ai\library\specializations\code-migration-modernization\skills\migration-validator\SKILL.md,
milvus-integration,yes,1,Milvus distributed vector database configuration for large-scale RAG applications,C:\Users\Treml\.claude\plugins\marketplaces\a5c.ai\library\specializations\ai-agents-conversational\skills\milvus-integration\SKILL.md,
mindtickle-readiness,yes,1,Mindtickle sales readiness platform for skills assessment,C:\Users\Treml\.claude\plugins\marketplaces\a5c.ai\library\specializations\domains\business\sales\skills\mindtickle-readiness\SKILL.md,
minimal-plugin-skill,yes,1,Minimal plugin skill fixture. Use when a test needs a valid plugin skill.,C:\Users\Treml\.codex\.tmp\plugins\plugins\plugin-eval\fixtures\minimal-plugin\skills\minimal-plugin-skill\SKILL.md,
minimal-skill,yes,1,Minimal example skill for plugin-eval tests. Use when the user wants a compact demonstration of a well-structured skill.,C:\Users\Treml\.codex\.tmp\plugins\plugins\plugin-eval\fixtures\minimal-skill\SKILL.md,
misra-c-analysis,yes,1,MISRA C compliance checking and static analysis integration,C:\Users\Treml\.claude\plugins\marketplaces\a5c.ai\library\specializations\embedded-systems\skills\misra-c-analysis\SKILL.md,
misra-compliance,yes,1,MISRA C/C++ static analysis and compliance checking,C:\Users\Treml\.claude\plugins\marketplaces\a5c.ai\library\specializations\domains\science\automotive-engineering\skills\misra-compliance\SKILL.md,
mission-trajectory,yes,1,Expert skill for space mission design and trajectory analysis,C:\Users\Treml\.claude\plugins\marketplaces\a5c.ai\library\specializations\domains\science\aerospace-engineering\skills\mission-trajectory\SKILL.md,
mitiq-error-mitigator,yes,1,Error mitigation skill using Mitiq for NISQ device noise reduction,C:\Users\Treml\.claude\plugins\marketplaces\a5c.ai\library\specializations\domains\science\quantum-computing\skills\mitiq-error-mitigator\SKILL.md,
MITRE ATT&CK Skill,yes,1,MITRE ATT&CK framework mapping and analysis,C:\Users\Treml\.claude\plugins\marketplaces\a5c.ai\library\specializations\security-research\skills\mitre-attack\SKILL.md,
mixed-integer-optimization,yes,1,Mixed-integer linear and nonlinear programming,C:\Users\Treml\.claude\plugins\marketplaces\a5c.ai\library\specializations\domains\science\mathematics\skills\mixed-integer-optimization\SKILL.md,
mixed-methods-integration,yes,1,"Design and execute convergent, explanatory sequential, and exploratory sequential mixed methods research designs",C:\Users\Treml\.claude\plugins\marketplaces\a5c.ai\library\specializations\domains\social-sciences-humanities\social-sciences\skills\mixed-methods-integration\SKILL.md,
mkdocs-material,yes,1,"MkDocs with Material theme expertise for Python-centric documentation. Configure navigation, plugins, multi-language support, PDF export, and advanced Material theme features.",C:\Users\Treml\.claude\plugins\marketplaces\a5c.ai\library\specializations\technical-documentation\skills\mkdocs-material\SKILL.md,
ml-materials-predictor,yes,1,Machine learning skill for nanomaterial property prediction and discovery acceleration,C:\Users\Treml\.claude\plugins\marketplaces\a5c.ai\library\specializations\domains\science\nanotechnology\skills\ml-materials-predictor\SKILL.md,
mlflow-experiment-tracker,yes,1,"MLflow integration skill for experiment tracking, model registry, and artifact management. Enables LLMs to log experiments, compare runs, manage model lifecycle, and retrieve artifacts through the MLflow API.",C:\Users\Treml\.claude\plugins\marketplaces\a5c.ai\library\specializations\data-science-ml\skills\mlflow-experiment-tracker\SKILL.md,
Mobile Analytics,yes,1,Mobile app analytics and crash reporting integration,C:\Users\Treml\.claude\plugins\marketplaces\a5c.ai\library\specializations\mobile-development\skills\mobile-analytics\SKILL.md,
Mobile Offline Storage,yes,1,Cross-platform offline-first data management,C:\Users\Treml\.claude\plugins\marketplaces\a5c.ai\library\specializations\mobile-development\skills\offline-storage\SKILL.md,
Mobile Performance Profiling,yes,1,Mobile app performance analysis and optimization,C:\Users\Treml\.claude\plugins\marketplaces\a5c.ai\library\specializations\mobile-development\skills\mobile-perf\SKILL.md,
Mobile Security Testing Skill,yes,1,Android and iOS application security testing,C:\Users\Treml\.claude\plugins\marketplaces\a5c.ai\library\specializations\security-research\skills\mobile-security\SKILL.md,
Mobile Testing Frameworks,yes,1,Comprehensive mobile testing framework expertise,C:\Users\Treml\.claude\plugins\marketplaces\a5c.ai\library\specializations\mobile-development\skills\mobile-testing\SKILL.md,
mobile-ads,yes,1,Ad mediation skill for rewarded video.,C:\Users\Treml\.claude\plugins\marketplaces\a5c.ai\library\specializations\game-development\skills\mobile-ads\SKILL.md,
mobile-optimization,yes,1,Mobile GPU optimization skill for thermal management.,C:\Users\Treml\.claude\plugins\marketplaces\a5c.ai\library\specializations\game-development\skills\mobile-optimization\SKILL.md,
mobile-security,yes,1,"Mobile application security skill for implementing OWASP MASVS compliance, secure storage, certificate pinning, biometric authentication, and security hardening across iOS and Android platforms.",C:\Users\Treml\.claude\plugins\marketplaces\a5c.ai\library\specializations\mobile-development\skills\mobile-security\SKILL.md,
mock-spec-extractor,yes,1,"Extracts design specifications from mock images including colors, typography, spacing, and component details",C:\Users\Treml\.claude\plugins\marketplaces\a5c.ai\library\specializations\ux-ui-design\skills\mock-spec-extractor\SKILL.md,
model,yes,2,Inspect or change Babysitter model-routing policy by phase.,C:\Users\Treml\.claude\plugins\marketplaces\a5c.ai\plugins\babysitter-codex\skills\model\SKILL.md,C:\Users\Treml\.codex\plugins\cache\babysitter-local\babysitter\0.1.5\skills\model\SKILL.md
model-card-generator,yes,1,Model documentation skill for generating model cards following Google's model card framework.,C:\Users\Treml\.claude\plugins\marketplaces\a5c.ai\library\specializations\data-science-ml\skills\model-card-generator\SKILL.md,
model-checker-interface,yes,1,Interface with multiple model checking tools for formal verification,C:\Users\Treml\.claude\plugins\marketplaces\a5c.ai\library\specializations\domains\science\computer-science\skills\model-checker-interface\SKILL.md,
model-profile-resolution,yes,1,Resolve model profile (quality/balanced/budget) at orchestration start and map agents to specific models. Enables cost/quality tradeoffs by selecting appropriate AI models for each agent role.,C:\Users\Treml\.claude\plugins\marketplaces\a5c.ai\library\methodologies\gsd\skills\model-profile-resolution\SKILL.md,
module-systems,yes,1,"Expert skill for designing module systems including resolution algorithms, import/export mechanisms, visibility control, namespace management, and cyclic dependency handling.",C:\Users\Treml\.claude\plugins\marketplaces\a5c.ai\library\specializations\programming-languages\skills\module-systems\SKILL.md,
mongodb,yes,1,"MongoDB schema design, aggregation pipelines, indexing strategies, and performance.",C:\Users\Treml\.claude\plugins\marketplaces\a5c.ai\library\specializations\web-development\skills\mongodb\SKILL.md,
monte-carlo-engine,yes,1,"Monte Carlo simulation engine skill for probabilistic modeling, risk quantification, and uncertainty propagation",C:\Users\Treml\.claude\plugins\marketplaces\a5c.ai\library\specializations\domains\business\decision-intelligence\skills\monte-carlo-engine\SKILL.md,
monte-carlo-financial-simulator,yes,1,Stochastic simulation skill for financial modeling with probability distributions and risk quantification,C:\Users\Treml\.claude\plugins\marketplaces\a5c.ai\library\specializations\domains\business\finance-accounting\skills\monte-carlo-financial-simulator\SKILL.md,
monte-carlo-physics-simulator,yes,1,"Monte Carlo simulation skill for statistical physics, particle transport, and stochastic processes",C:\Users\Treml\.claude\plugins\marketplaces\a5c.ai\library\specializations\domains\science\physics\skills\monte-carlo-physics-simulator\SKILL.md,
monte-carlo-simulation,yes,1,Monte Carlo methods for uncertainty quantification,C:\Users\Treml\.claude\plugins\marketplaces\a5c.ai\library\specializations\domains\science\mathematics\skills\monte-carlo-simulation\SKILL.md,
morphosyntactic-analysis,yes,1,Parse word structure and sentence patterns to document grammatical systems for language description and typology,C:\Users\Treml\.claude\plugins\marketplaces\a5c.ai\library\specializations\domains\social-sciences-humanities\humanities\skills\morphosyntactic-analysis\SKILL.md,
Motion Planning Skill,yes,1,Sampling-based and optimization-based motion planning algorithms,C:\Users\Treml\.claude\plugins\marketplaces\a5c.ai\library\specializations\robotics-simulation\skills\motion-planning\SKILL.md,
motion-capture-analyzer,yes,1,Motion capture data processing and analysis skill for gait analysis and biomechanical studies,C:\Users\Treml\.claude\plugins\marketplaces\a5c.ai\library\specializations\domains\science\biomedical-engineering\skills\motion-capture-analyzer\SKILL.md,
motion-matching,yes,1,Motion matching skill for animation databases.,C:\Users\Treml\.claude\plugins\marketplaces\a5c.ai\library\specializations\game-development\skills\motion-matching\SKILL.md,
motor-control,yes,1,Motor control algorithms and driver implementation,C:\Users\Treml\.claude\plugins\marketplaces\a5c.ai\library\specializations\embedded-systems\skills\motor-control\SKILL.md,
MoveIt Motion Planning Skill,yes,1,Deep expertise in MoveIt/MoveIt2 configuration and manipulation planning,C:\Users\Treml\.claude\plugins\marketplaces\a5c.ai\library\specializations\robotics-simulation\skills\moveit-planning\SKILL.md,
MPC Controller Skill,yes,1,Expert skill for Model Predictive Control implementation and tuning,C:\Users\Treml\.claude\plugins\marketplaces\a5c.ai\library\specializations\robotics-simulation\skills\mpc-controller\SKILL.md,
mpc-configurator,yes,1,"Model Predictive Control configuration skill for MPC model identification, tuning, and implementation",C:\Users\Treml\.claude\plugins\marketplaces\a5c.ai\library\specializations\domains\science\chemical-engineering\skills\mpc-configurator\SKILL.md,
msix-package-generator,yes,1,"Generate MSIX packaging configuration with manifest, assets, and signing for Windows applications",C:\Users\Treml\.claude\plugins\marketplaces\a5c.ai\library\specializations\desktop-development\skills\msix-package-generator\SKILL.md,
msw,yes,1,"Mock Service Worker API mocking, request handlers, and integration testing.",C:\Users\Treml\.claude\plugins\marketplaces\a5c.ai\library\specializations\web-development\skills\msw\SKILL.md,
multi-cloud-security-posture,yes,1,"Unified cloud security posture management across AWS, Azure, and GCP with normalized metrics and CIS benchmark comparison",C:\Users\Treml\.claude\plugins\marketplaces\a5c.ai\library\specializations\security-compliance\skills\multi-cloud-security-posture\SKILL.md,
multi-jurisdiction-tax-calculator,yes,1,Multi-state and international tax calculation skill with nexus analysis,C:\Users\Treml\.claude\plugins\marketplaces\a5c.ai\library\specializations\domains\business\finance-accounting\skills\multi-jurisdiction-tax-calculator\SKILL.md,
Multi-Robot Coordination Skill,yes,1,Coordination and task allocation for multi-robot systems and fleets,C:\Users\Treml\.claude\plugins\marketplaces\a5c.ai\library\specializations\robotics-simulation\skills\multi-robot-coordination\SKILL.md,
multi-service-orchestration,yes,1,"PM2 process management, backend/frontend cascade execution, parallel worktree builds, and cross-service integration testing.",C:\Users\Treml\.claude\plugins\marketplaces\a5c.ai\library\methodologies\everything-claude-code\skills\multi-service-orchestration\SKILL.md,
multimedia-learning-design,yes,1,"Apply Mayer's multimedia learning principles to design effective audio, video, graphics, and animations that reduce cognitive load",C:\Users\Treml\.claude\plugins\marketplaces\a5c.ai\library\specializations\domains\social-sciences-humanities\education\skills\multimedia-learning-design\SKILL.md,
multiple-calculator,yes,1,"Calculates valuation multiples (EV/Revenue, EV/EBITDA, P/E) with sector adjustments",C:\Users\Treml\.claude\plugins\marketplaces\a5c.ai\library\specializations\domains\business\venture-capital\skills\multiple-calculator\SKILL.md,
multiple-testing-correction,yes,1,Multiple comparison correction methods,C:\Users\Treml\.claude\plugins\marketplaces\a5c.ai\library\specializations\domains\science\mathematics\skills\multiple-testing-correction\SKILL.md,
music-prompt-engineering,yes,1,"Optimize and format prompts specifically for AI music generation platforms like Suno and Udio, including platform-specific syntax and tag optimization",C:\Users\Treml\.claude\plugins\marketplaces\a5c.ai\library\specializations\domains\social-sciences-humanities\arts-culture\music-album-creation\skills\music-prompt-engineering\SKILL.md,
mutually-exclusive-group-handler,yes,1,Generate logic for handling mutually exclusive argument groups with clear error messages and validation in CLI applications.,C:\Users\Treml\.claude\plugins\marketplaces\a5c.ai\library\specializations\cli-mcp-development\skills\mutually-exclusive-group-handler\SKILL.md,
mythril-symbolic,yes,1,"Symbolic execution analysis using Mythril for deep vulnerability detection in smart contracts. Supports configurable transaction depth, timeout settings, and proof-of-concept exploit generation.",C:\Users\Treml\.claude\plugins\marketplaces\a5c.ai\library\specializations\cryptography-blockchain\skills\mythril-symbolic\SKILL.md,
nanocatalyst-performance-analyzer,yes,1,"Nanocatalysis skill for evaluating catalytic activity, selectivity, and stability of nanomaterial catalysts",C:\Users\Treml\.claude\plugins\marketplaces\a5c.ai\library\specializations\domains\science\nanotechnology\skills\nanocatalyst-performance-analyzer\SKILL.md,
nanohub-simulator-interface,yes,1,NanoHUB tool interface skill for accessing educational and research nanoscience simulations,C:\Users\Treml\.claude\plugins\marketplaces\a5c.ai\library\specializations\domains\science\nanotechnology\skills\nanohub-simulator-interface\SKILL.md,
nanoimprint-process-controller,yes,1,Nanoimprint Lithography skill for high-throughput nanopatterning with template management and demolding optimization,C:\Users\Treml\.claude\plugins\marketplaces\a5c.ai\library\specializations\domains\science\nanotechnology\skills\nanoimprint-process-controller\SKILL.md,
nanomaterial-lims-manager,yes,1,Laboratory Information Management System skill for nanomaterial sample tracking and data management,C:\Users\Treml\.claude\plugins\marketplaces\a5c.ai\library\specializations\domains\science\nanotechnology\skills\nanomaterial-lims-manager\SKILL.md,
nanomaterial-sds-generator,yes,1,Safety documentation skill for generating Safety Data Sheets for nanomaterials,C:\Users\Treml\.claude\plugins\marketplaces\a5c.ai\library\specializations\domains\science\nanotechnology\skills\nanomaterial-sds-generator\SKILL.md,
nanoparticle-synthesis-optimizer,yes,1,"Synthesis parameter optimization skill for metal, semiconductor, and oxide nanoparticle production with automated protocol generation and reproducibility validation",C:\Users\Treml\.claude\plugins\marketplaces\a5c.ai\library\specializations\domains\science\nanotechnology\skills\nanoparticle-synthesis-optimizer\SKILL.md,
nanosensor-calibration-manager,yes,1,"Nanosensor characterization skill for calibration, sensitivity analysis, and selectivity validation",C:\Users\Treml\.claude\plugins\marketplaces\a5c.ai\library\specializations\domains\science\nanotechnology\skills\nanosensor-calibration-manager\SKILL.md,
native-data-fetching,yes,1,"Use when implementing or debugging ANY network request, API call, or data fetching. Covers fetch API, React Query, SWR, error handling, caching, offline support, and Expo Router data loaders (`useLoaderData`).",C:\Users\Treml\.codex\.tmp\plugins\plugins\expo\skills\native-data-fetching\SKILL.md,
native-notification-builder,yes,1,"Build native OS notifications with actions, images, and progress indicators across platforms",C:\Users\Treml\.claude\plugins\marketplaces\a5c.ai\library\specializations\desktop-development\skills\native-notification-builder\SKILL.md,
Nav2 Navigation Skill,yes,1,Specialized skill for ROS2 Nav2 navigation stack configuration and behavior trees,C:\Users\Treml\.claude\plugins\marketplaces\a5c.ai\library\specializations\robotics-simulation\skills\nav2-navigation\SKILL.md,
navmesh,yes,1,"Navigation mesh generation and pathfinding skill for game AI. Enables creation and configuration of navigation meshes, pathfinding queries, dynamic obstacles, and navigation agent setup across Unity, Unreal, and Godot engines.",C:\Users\Treml\.claude\plugins\marketplaces\a5c.ai\library\specializations\game-development\skills\navmesh\SKILL.md,
nbodykit-cosmology-analyzer,yes,1,nbodykit large-scale structure analysis skill for N-body simulations and galaxy surveys,C:\Users\Treml\.claude\plugins\marketplaces\a5c.ai\library\specializations\domains\science\physics\skills\nbodykit-cosmology-analyzer\SKILL.md,
ncbi-blast-skill,yes,1,"Submit, poll, and summarize NCBI BLAST Common URL API jobs (Blast.cgi) for nucleotide or protein sequences. Use when a user wants RID status, BLAST results, or compact top-hit summaries; fetch raw Text/JSON2 only on request.",C:\Users\Treml\.codex\.tmp\plugins\plugins\life-science-research\skills\ncbi-blast-skill\SKILL.md,
ncbi-clinicaltables-skill,yes,1,"Submit compact Clinical Tables NCBI Gene requests for human gene lookup, pagination, and field selection. Use when a user wants concise autocomplete-style human gene search results",C:\Users\Treml\.codex\.tmp\plugins\plugins\life-science-research\skills\ncbi-clinicaltables-skill\SKILL.md,
ncbi-datasets-skill,yes,1,"Submit compact NCBI Datasets v2 requests for assembly, genome, taxonomy, and related metadata endpoints. Use when a user wants concise NCBI Datasets summaries; save raw JSON or text only on request.",C:\Users\Treml\.codex\.tmp\plugins\plugins\life-science-research\skills\ncbi-datasets-skill\SKILL.md,
ncbi-entrez-skill,yes,1,"Submit compact NCBI Entrez E-Utilities requests for PubMed, Gene, Protein, Nucleotide, PMC metadata, and GEO metadata workflows. Use when a user wants concise Entrez search, fetch, summary, or link results; save raw JSON or XML only on request.",C:\Users\Treml\.codex\.tmp\plugins\plugins\life-science-research\skills\ncbi-entrez-skill\SKILL.md,
ncbi-pmc-skill,yes,1,Submit compact NCBI PMC Open Access requests for article/file availability metadata. Use when a user wants concise PMC Open Access summaries; save raw XML only on request.,C:\Users\Treml\.codex\.tmp\plugins\plugins\life-science-research\skills\ncbi-pmc-skill\SKILL.md,
ncc,yes,1,"Expert guidance for @vercel/ncc — a simple CLI for compiling Node.js modules into a single file with all dependencies included. Use when bundling serverless functions, CLI tools, or any Node.js project into a self-contained file.",C:\Users\Treml\.codex\.tmp\plugins\plugins\vercel\skills\ncc\SKILL.md,
