name,has_yaml,copies,description,kept_source_path,other_copy_paths
360-feedback,yes,1,"Design, administer, and analyze 360-degree feedback surveys for leadership development",C:\Users\Treml\.claude\plugins\marketplaces\a5c.ai\library\specializations\domains\business\human-resources\skills\360-feedback\SKILL.md,
6sense-intent,yes,1,6sense intent data and anonymous buyer identification platform,C:\Users\Treml\.claude\plugins\marketplaces\a5c.ai\library\specializations\domains\business\sales\skills\6sense-intent\SKILL.md,
A/B Test Design,yes,1,Statistical experiment design and analysis capabilities for product experimentation,C:\Users\Treml\.claude\plugins\marketplaces\a5c.ai\library\specializations\product-management\skills\ab-test-design\SKILL.md,
A/B Test Statistical Analyzer,yes,1,Performs statistical analysis for A/B testing experiments,C:\Users\Treml\.claude\plugins\marketplaces\a5c.ai\library\specializations\data-engineering-analytics\skills\ab-test-statistical-analyzer\SKILL.md,
a11y-debugging,yes,1,"Uses Chrome DevTools MCP for accessibility (a11y) debugging and auditing based on web.dev guidelines. Use when testing semantic HTML, ARIA labels, focus states, keyboard navigation, tap targets, and color contrast.",C:\Users\Treml\.claude\plugins\cache\claude-plugins-official\chrome-devtools-mcp\0.22.0\skills\a11y-debugging\SKILL.md,
a3-problem-solver,yes,1,A3 problem-solving and status reporting skill with structured thinking and coaching support,C:\Users\Treml\.claude\plugins\marketplaces\a5c.ai\library\specializations\domains\business\operations\skills\a3-problem-solver\SKILL.md,
a3-problem-solver,yes,1,A3 problem-solving skill for structured problem analysis and countermeasure development.,C:\Users\Treml\.claude\plugins\marketplaces\a5c.ai\library\specializations\domains\science\industrial-engineering\skills\a3-problem-solver\SKILL.md,
ab-testing,yes,1,A/B testing skill for player segmentation.,C:\Users\Treml\.claude\plugins\marketplaces\a5c.ai\library\specializations\game-development\skills\ab-testing\SKILL.md,
abc-xyz-classifier,yes,1,Multi-dimensional inventory classification skill combining value (ABC) and demand variability (XYZ) analysis for differentiated policies,C:\Users\Treml\.claude\plugins\marketplaces\a5c.ai\library\specializations\domains\business\logistics\skills\abc-xyz-classifier\SKILL.md,
abstract-domain-library,yes,1,Library of abstract domains for static analysis and abstract interpretation,C:\Users\Treml\.claude\plugins\marketplaces\a5c.ai\library\specializations\domains\science\computer-science\skills\abstract-domain-library\SKILL.md,
academic-writing-assistant,yes,1,Skill for assisting with academic and scientific writing,C:\Users\Treml\.claude\plugins\marketplaces\a5c.ai\library\specializations\domains\science\scientific-discovery\skills\academic-writing-assistant\SKILL.md,
academic-writing-publication,yes,1,"Prepare manuscripts following APA, ASA, or discipline-specific guidelines with proper reporting standards and peer review navigation",C:\Users\Treml\.claude\plugins\marketplaces\a5c.ai\library\specializations\domains\social-sciences-humanities\social-sciences\skills\academic-writing-publication\SKILL.md,
access,yes,1,"Manage Discord channel access — approve pairings, edit allowlists, set DM/group policy. Use when the user asks to pair, approve someone, check who's allowed, or change policy for the Discord channel.",C:\Users\Treml\.claude\plugins\marketplaces\claude-plugins-official\external_plugins\discord\skills\access\SKILL.md,
access,yes,1,"Manage iMessage channel access — approve pairings, edit allowlists, set DM/group policy. Use when the user asks to pair, approve someone, check who's allowed, or change policy for the iMessage channel.",C:\Users\Treml\.claude\plugins\marketplaces\claude-plugins-official\external_plugins\imessage\skills\access\SKILL.md,
access,yes,1,"Manage Telegram channel access — approve pairings, edit allowlists, set DM/group policy. Use when the user asks to pair, approve someone, check who's allowed, or change policy for the Telegram channel.",C:\Users\Treml\.claude\plugins\marketplaces\claude-plugins-official\external_plugins\telegram\skills\access\SKILL.md,
accessibility-compliance,yes,1,"Ensure cultural programs and facilities meet ADA requirements and universal design principles including accommodations, assistive technologies, and inclusive practices",C:\Users\Treml\.claude\plugins\marketplaces\a5c.ai\library\specializations\domains\social-sciences-humanities\arts-culture\skills\accessibility-compliance\SKILL.md,
accessibility-compliance-auditing,yes,1,"Evaluate learning materials and technology for WCAG, Section 508, and accessibility compliance with remediation recommendations",C:\Users\Treml\.claude\plugins\marketplaces\a5c.ai\library\specializations\domains\social-sciences-humanities\education\skills\accessibility-compliance-auditing\SKILL.md,
accessibility-games,yes,1,Game accessibility skill for colorblind modes and control remapping.,C:\Users\Treml\.claude\plugins\marketplaces\a5c.ai\library\specializations\game-development\skills\accessibility-games\SKILL.md,
accessibility-report,yes,1,Generate accessibility compliance reports including VPAT and ACR documents,C:\Users\Treml\.claude\plugins\marketplaces\a5c.ai\library\specializations\ux-ui-design\skills\accessibility-report\SKILL.md,
accessibility-test-runner,yes,1,Run accessibility audits with axe-core and screen reader testing for desktop applications,C:\Users\Treml\.claude\plugins\marketplaces\a5c.ai\library\specializations\desktop-development\skills\accessibility-test-runner\SKILL.md,
accessibility-testing,yes,1,"Mobile accessibility testing skill for WCAG compliance, VoiceOver/TalkBack validation, dynamic type support, color contrast analysis, and accessibility auditing across iOS and Android platforms.",C:\Users\Treml\.claude\plugins\marketplaces\a5c.ai\library\specializations\mobile-development\skills\accessibility-testing\SKILL.md,
account-reconciliation-automator,yes,1,Automated account reconciliation skill with matching algorithms and exception handling,C:\Users\Treml\.claude\plugins\marketplaces\a5c.ai\library\specializations\domains\business\finance-accounting\skills\account-reconciliation-automator\SKILL.md,
accreditation-tracer-simulation,yes,1,Simulate Joint Commission tracer methodology to assess compliance with accreditation standards across patient care processes and support systems,C:\Users\Treml\.claude\plugins\marketplaces\a5c.ai\library\specializations\domains\social-sciences-humanities\healthcare\skills\accreditation-tracer-simulation\SKILL.md,
acmg-variant-classifier,yes,1,ACMG/AMP variant classification skill for systematic pathogenicity assessment,C:\Users\Treml\.claude\plugins\marketplaces\a5c.ai\library\specializations\domains\science\bioinformatics\skills\acmg-variant-classifier\SKILL.md,
action-item-tracker,yes,1,"Tracks board action items, follow-ups, commitments across companies",C:\Users\Treml\.claude\plugins\marketplaces\a5c.ai\library\specializations\domains\business\venture-capital\skills\action-item-tracker\SKILL.md,
actionable-error-formatter,yes,1,Format errors with actionable fix suggestions and documentation links,C:\Users\Treml\.claude\plugins\marketplaces\a5c.ai\library\specializations\sdk-platform-development\skills\actionable-error-formatter\SKILL.md,
ada-compliance-checker,yes,1,"ADA accessibility compliance checking skill for routes, slopes, and pedestrian facilities",C:\Users\Treml\.claude\plugins\marketplaces\a5c.ai\library\specializations\domains\science\civil-engineering\skills\ada-compliance-checker\SKILL.md,
adaptive-music,yes,1,Adaptive music skill for horizontal/vertical resequencing and stingers.,C:\Users\Treml\.claude\plugins\marketplaces\a5c.ai\library\specializations\game-development\skills\adaptive-music\SKILL.md,
additive-manufacturing,yes,1,"Skill for additive manufacturing process selection, design optimization, and build preparation",C:\Users\Treml\.claude\plugins\marketplaces\a5c.ai\library\specializations\domains\science\mechanical-engineering\skills\additive-manufacturing\SKILL.md,
adkar-assessment,yes,1,Assess and track ADKAR change readiness across stakeholder groups with intervention recommendations,C:\Users\Treml\.claude\plugins\marketplaces\a5c.ai\library\specializations\domains\business\business-analysis\skills\adkar-assessment\SKILL.md,
adr-generator,yes,1,"Specialized skill for generating and managing Architecture Decision Records (ADRs). Supports Nygard, MADR, and custom templates with auto-numbering, linking, and status management.",C:\Users\Treml\.claude\plugins\marketplaces\a5c.ai\library\specializations\software-architecture\skills\adr-generator\SKILL.md,
advanced-ds-library,yes,1,Provide implementations of advanced data structures,C:\Users\Treml\.claude\plugins\marketplaces\a5c.ai\library\specializations\algorithms-optimization\skills\advanced-ds-library\SKILL.md,
adversarial-review,yes,1,"Fresh adversarial code review with binary PASS/FAIL verdicts, evidence citations, and anchoring bias prevention via fresh reviewer spawning.",C:\Users\Treml\.claude\plugins\marketplaces\a5c.ai\library\methodologies\metaswarm\skills\adversarial-review\SKILL.md,
adverse-event-reporter,yes,1,Adverse event monitoring and reporting skill for MDR/MEDWATCH compliance,C:\Users\Treml\.claude\plugins\marketplaces\a5c.ai\library\specializations\domains\science\biomedical-engineering\skills\adverse-event-reporter\SKILL.md,
aero-cfd,yes,1,Vehicle aerodynamics simulation and optimization expertise,C:\Users\Treml\.claude\plugins\marketplaces\a5c.ai\library\specializations\domains\science\automotive-engineering\skills\aero-cfd\SKILL.md,
aero-database,yes,1,Systematic generation and management of aerodynamic coefficient databases,C:\Users\Treml\.claude\plugins\marketplaces\a5c.ai\library\specializations\domains\science\aerospace-engineering\skills\aero-database\SKILL.md,
aeroelastic-analysis,yes,1,"Skill for flutter, divergence, and aeroelastic response analysis",C:\Users\Treml\.claude\plugins\marketplaces\a5c.ai\library\specializations\domains\science\aerospace-engineering\skills\aeroelastic-analysis\SKILL.md,
aflow-materials-discovery,yes,1,AFLOW automatic materials discovery skill for high-throughput DFT calculations and materials database queries,C:\Users\Treml\.claude\plugins\marketplaces\a5c.ai\library\specializations\domains\science\physics\skills\aflow-materials-discovery\SKILL.md,
afm-spm-analyzer,yes,1,"Atomic Force Microscopy and Scanning Probe Microscopy skill for nanoscale topography, mechanical, and electrical property mapping",C:\Users\Treml\.claude\plugins\marketplaces\a5c.ai\library\specializations\domains\science\nanotechnology\skills\afm-spm-analyzer\SKILL.md,
Agent Development,yes,1,"This skill should be used when the user asks to ""create an agent"", ""add an agent"", ""write a subagent"", ""agent frontmatter"", ""when to use description"", ""agent examples"", ""agent tools"", ""agent colors"", ""autonomous agent"", or needs guidance on agent structure, system prompts, triggering conditions, or agent development best practices for Claude Code plugins.",C:\Users\Treml\.claude\plugins\marketplaces\claude-code-plugins\plugins\plugin-dev\skills\agent-development\SKILL.md,
agent-based-simulator,yes,1,Agent-based modeling skill for simulating complex adaptive systems with heterogeneous interacting agents,C:\Users\Treml\.claude\plugins\marketplaces\a5c.ai\library\specializations\domains\business\decision-intelligence\skills\agent-based-simulator\SKILL.md,
agent-booster,yes,1,"WASM-based instant code transforms for simple tasks, achieving 352x speedup over LLM inference with zero cost.",C:\Users\Treml\.claude\plugins\marketplaces\a5c.ai\library\methodologies\ruflo\skills\agent-booster\SKILL.md,
agent-browser,yes,1,"Browser automation CLI for AI agents. Use when the user needs to interact with websites, verify dev server output, test web apps, navigate pages, fill forms, click buttons, take screenshots, extract data, or automate any browser task. Also triggers when a dev server starts so you can verify it visually.",C:\Users\Treml\.codex\.tmp\plugins\plugins\vercel\skills\agent-browser\SKILL.md,
agent-browser-verify,yes,1,"Automated browser verification for dev servers. Triggers when a dev server starts to run a visual gut-check with agent-browser — verifies the page loads, checks for console errors, validates key UI elements, and reports pass/fail before continuing.",C:\Users\Treml\.codex\.tmp\plugins\plugins\vercel\skills\agent-browser-verify\SKILL.md,
agent-coordination,yes,1,Coordinate Crew (persistent) and Polecat (transient) agents using Gas Town's hook-based work distribution and GUPP principle.,C:\Users\Treml\.claude\plugins\marketplaces\a5c.ai\library\methodologies\gastown\skills\agent-coordination\SKILL.md,
agent-development,yes,2,"This skill should be used when the user asks to ""create an agent"", ""add an agent"", ""write a subagent"", ""agent frontmatter"", ""when to use description"", ""agent examples"", ""agent tools"", ""agent colors"", ""autonomous agent"", or needs guidance on agent structure, system prompts, triggering conditions, or agent development best practices for Claude Code plugins.",C:\Users\Treml\.claude\plugins\marketplaces\claude-plugins-official\plugins\plugin-dev\skills\agent-development\SKILL.md,C:\Users\Treml\.claude\plugins\cache\claude-plugins-official\plugin-dev\unknown\skills\agent-development\SKILL.md
agent-dispatch,no,1,,C:\Users\Treml\.claude\plugins\marketplaces\a5c.ai\library\methodologies\automaker\skills\agent-dispatch\SKILL.md,
agent-generator,yes,1,"Generate AGENT.md files with proper YAML frontmatter, role definitions, expertise areas, and prompt templates following Babysitter SDK conventions.",C:\Users\Treml\.claude\plugins\marketplaces\a5c.ai\library\specializations\meta\skills\agent-generator\SKILL.md,
agent-ready-apis,yes,1,"Knowledge about AI agent API compatibility. Use when user asks about API readiness, agent compatibility, or wants to improve their API for AI consumption.",C:\Users\Treml\.claude\plugins\cache\claude-plugins-official\postman\1.0.0\skills\agent-ready-apis\SKILL.md,
agents-sdk,yes,1,"Build AI agents on Cloudflare Workers using the Agents SDK. Load when creating stateful agents, durable workflows, real-time WebSocket apps, scheduled tasks, MCP servers, or chat applications. Covers Agent class, state management, callable RPC, Workflows integration, and React hooks. Biases towards retrieval from Cloudflare docs over pre-trained knowledge.",C:\Users\Treml\.codex\.tmp\plugins\plugins\cloudflare\skills\agents-sdk\SKILL.md,
agents-sdk,yes,1,"Build, run, deploy, and evaluate OpenAI Agents SDK apps from Codex. Use when the user asks to create or adapt an Agents SDK app, build from a prompt or Codex thread, prepare a runnable agent prototype, add a focused eval harness, or deploy locally through the Agents SDK Deployment Manager.",C:\Users\Treml\.codex\.tmp\plugins\plugins\openai-developers\skills\agents-sdk\SKILL.md,
agile-metrics-calculator,yes,1,"Calculate and analyze Agile delivery metrics including velocity, burndown, and flow metrics",C:\Users\Treml\.claude\plugins\marketplaces\a5c.ai\library\specializations\domains\business\project-management\skills\agile-metrics-calculator\SKILL.md,
ahp-calculator,yes,1,"Analytic Hierarchy Process (AHP) calculation skill for pairwise comparison matrices, consistency checking, and weight derivation",C:\Users\Treml\.claude\plugins\marketplaces\a5c.ai\library\specializations\domains\business\decision-intelligence\skills\ahp-calculator\SKILL.md,
ai-elements,yes,1,"AI Elements component library guidance — pre-built React components for AI interfaces built on shadcn/ui. Use when building chat UIs, message displays, tool call rendering, streaming responses, reasoning panels, or any AI-native interface with the AI SDK.",C:\Users\Treml\.codex\.tmp\plugins\plugins\vercel\skills\ai-elements\SKILL.md,
ai-gateway,yes,1,"Vercel AI Gateway expert guidance. Use when configuring model routing, provider failover, cost tracking, or managing multiple AI providers through a unified API.",C:\Users\Treml\.claude\plugins\cache\claude-plugins-official\vercel\0.42.1\skills\ai-gateway\SKILL.md,
ai-gateway,yes,1,"Vercel AI Gateway expert guidance. Use when configuring model routing, provider failover, cost tracking, or managing multiple AI providers through a unified API.",C:\Users\Treml\.codex\.tmp\plugins\plugins\vercel\skills\ai-gateway\SKILL.md,
ai-generation-persistence,yes,1,"AI generation persistence patterns — unique IDs, addressable URLs, database storage, and cost tracking for every LLM generation",C:\Users\Treml\.codex\.tmp\plugins\plugins\vercel\skills\ai-generation-persistence\SKILL.md,
ai-sdk,yes,1,"Vercel AI SDK expert guidance. Use when building AI-powered features — chat interfaces, text generation, structured output, tool calling, agents, MCP integration, streaming, embeddings, reranking, image generation, or working with any LLM provider.",C:\Users\Treml\.claude\plugins\cache\claude-plugins-official\vercel\0.42.1\skills\ai-sdk\SKILL.md,
ai-sdk,yes,1,"Answer questions about the AI SDK and help build AI-powered features. Use when developers: (1) Ask about AI SDK functions like generateText, streamText, ToolLoopAgent, embed, or tools, (2) Want to build AI agents, chatbots, RAG systems, or text generation features, (3) Have questions about AI providers (OpenAI, Anthropic, Google, etc.), streaming, tool calling, structured output, or embeddings, (4) Use React hooks like useChat or useCompletion. Triggers on: ""AI SDK"", ""Vercel AI SDK"", ""generateText"", ""streamText"", ""add AI to my app"", ""build an agent"", ""tool calling"", ""structured output"", ""useChat"".",C:\Users\Treml\.claude\plugins\cache\claude-plugins-official\vercel\0.42.1\skills\ai-sdk\upstream\SKILL.md,
ai-sdk,yes,1,"Vercel AI SDK expert guidance. Use when building AI-powered features — chat interfaces, text generation, structured output, tool calling, agents, MCP integration, streaming, embeddings, reranking, image generation, or working with any LLM provider.",C:\Users\Treml\.codex\.tmp\plugins\plugins\vercel\skills\ai-sdk\SKILL.md,
ai-skill-packager,yes,1,"Convert loose notes, scripts, existing skills, agents, or MissionControl specialization folders into clean AI-ready skill or agent packages. Use when asked to clean up AI skill/agent materials, preserve an existing version, create a v2/codex-ready copy, package notes and scripts for AI use, or align a skill with Codex-style SKILL.md plus resources.",C:\Users\Treml\.codex\skills\ai-skill-packager\SKILL.md,
aiml-security,yes,1,"AI/ML model security testing and adversarial research capabilities. Generate adversarial examples, test model robustness, perform model extraction attacks, test for data poisoning, analyze model fairness, and support ART framework integration.",C:\Users\Treml\.claude\plugins\marketplaces\a5c.ai\library\specializations\security-research\skills\aiml-security\SKILL.md,
aiml-validation-framework,yes,1,AI/ML medical device validation skill implementing FDA's GMLP principles,C:\Users\Treml\.claude\plugins\marketplaces\a5c.ai\library\specializations\domains\science\biomedical-engineering\skills\aiml-validation-framework\SKILL.md,
air-pollution-control,yes,1,"Specialized skill for air pollution control equipment selection and design including scrubbers, baghouses, ESPs, oxidizers, and BACT/LAER determination.",C:\Users\Treml\.claude\plugins\marketplaces\a5c.ai\library\specializations\domains\science\environmental-engineering\skills\air-pollution-control\SKILL.md,
airflow-dag-analyzer,yes,1,"Analyzes, validates, and optimizes Apache Airflow DAGs for reliability, performance, and best practices adherence.",C:\Users\Treml\.claude\plugins\marketplaces\a5c.ai\library\specializations\data-engineering-analytics\skills\airflow-dag-analyzer\SKILL.md,
alarm-rationalization-tool,yes,1,"Alarm management skill for alarm rationalization, setpoint optimization, and ISA-18.2 compliance",C:\Users\Treml\.claude\plugins\marketplaces\a5c.ai\library\specializations\domains\science\chemical-engineering\skills\alarm-rationalization-tool\SKILL.md,
album-conceptualization,yes,1,"Develop cohesive album concepts including themes, motifs, sonic palettes, narrative arcs, track sequencing, and visual direction for unified album experiences",C:\Users\Treml\.claude\plugins\marketplaces\a5c.ai\library\specializations\domains\social-sciences-humanities\arts-culture\music-album-creation\skills\album-conceptualization\SKILL.md,
ald-process-controller,yes,1,Atomic Layer Deposition skill for conformal thin film deposition with atomic-level thickness control,C:\Users\Treml\.claude\plugins\marketplaces\a5c.ai\library\specializations\domains\science\nanotechnology\skills\ald-process-controller\SKILL.md,
algorithm-visualizer,yes,1,Generate visual representations of algorithm execution,C:\Users\Treml\.claude\plugins\marketplaces\a5c.ai\library\specializations\algorithms-optimization\skills\algorithm-visualizer\SKILL.md,
alibi-explainer,yes,1,"Alibi explainability skill for counterfactual explanations, anchors, and trust scores.",C:\Users\Treml\.claude\plugins\marketplaces\a5c.ai\library\specializations\data-science-ml\skills\alibi-explainer\SKILL.md,
Allure Test Reporting,yes,1,Allure test reporting framework for comprehensive test result visualization,C:\Users\Treml\.claude\plugins\marketplaces\a5c.ai\library\specializations\qa-testing-automation\skills\allure-reporting\SKILL.md,
alpha,yes,1,Alpha fixture skill. Use when plugin-eval tests need one of two bundled skills.,C:\Users\Treml\.codex\.tmp\plugins\plugins\plugin-eval\fixtures\multi-skill-plugin\skills\alpha\SKILL.md,
alphafold-predictor,yes,1,AlphaFold protein structure prediction skill with confidence assessment and model analysis,C:\Users\Treml\.claude\plugins\marketplaces\a5c.ai\library\specializations\domains\science\bioinformatics\skills\alphafold-predictor\SKILL.md,
alphafold-skill,yes,1,"Submit compact AlphaFold Protein Structure Database API requests for prediction, UniProt summary, sequence summary, and annotation lookups. Use when a user wants AlphaFold metadata or concise structure summaries",C:\Users\Treml\.codex\.tmp\plugins\plugins\life-science-research\skills\alphafold-skill\SKILL.md,
amortized-analysis-assistant,yes,1,"Apply amortized analysis techniques including aggregate, accounting, and potential methods",C:\Users\Treml\.claude\plugins\marketplaces\a5c.ai\library\specializations\domains\science\computer-science\skills\amortized-analysis-assistant\SKILL.md,
amplitude-desktop-integration,yes,1,Integrate Amplitude analytics with privacy controls for desktop applications,C:\Users\Treml\.claude\plugins\marketplaces\a5c.ai\library\specializations\desktop-development\skills\amplitude-desktop-integration\SKILL.md,
analogy-mapper,yes,1,Skill for identifying and mapping analogies across domains,C:\Users\Treml\.claude\plugins\marketplaces\a5c.ai\library\specializations\domains\science\scientific-discovery\skills\analogy-mapper\SKILL.md,
analytics,yes,1,"Google Analytics 4, tag management, and event tracking.",C:\Users\Treml\.claude\plugins\marketplaces\a5c.ai\library\specializations\web-development\skills\analytics\SKILL.md,
anaplan-planning,yes,1,Anaplan connected planning for territory and quota management,C:\Users\Treml\.claude\plugins\marketplaces\a5c.ai\library\specializations\domains\business\sales\skills\anaplan-planning\SKILL.md,
android-emulator-qa,yes,1,"Use when validating Android feature flows in an emulator with adb-driven launch, input, UI-tree inspection, screenshots, and logcat capture.",C:\Users\Treml\.codex\.tmp\plugins\plugins\test-android-apps\skills\android-emulator-qa\SKILL.md,
android-performance,yes,1,"Gather and interpret Android performance evidence on an adb target using Simpleperf CPU profiles, Perfetto or Compose traces, gfxinfo frame data, dumpsys meminfo snapshots, Java heap dumps, and native allocation traces. Use when asked to profile an Android app flow, find CPU-heavy functions, diagnose jank, capture startup or frame timing evidence, compare before/after performance, explain what code is taking time, or gather memory/leak profiling artifacts.",C:\Users\Treml\.codex\.tmp\plugins\plugins\test-android-apps\skills\android-performance\SKILL.md,
angular-development,yes,1,"Angular development patterns including modules, components, services, dependency injection, signals, and enterprise architecture.",C:\Users\Treml\.claude\plugins\marketplaces\a5c.ai\library\specializations\web-development\skills\angular-development\SKILL.md,
animation-blending,yes,1,Animation blending skill for blend trees.,C:\Users\Treml\.claude\plugins\marketplaces\a5c.ai\library\specializations\game-development\skills\animation-blending\SKILL.md,
animation-rigging,yes,1,Character rigging skill for IK constraints.,C:\Users\Treml\.claude\plugins\marketplaces\a5c.ai\library\specializations\game-development\skills\animation-rigging\SKILL.md,
animation-spec,yes,1,"Generate animation specifications, easing curves, and motion design documentation",C:\Users\Treml\.claude\plugins\marketplaces\a5c.ai\library\specializations\ux-ui-design\skills\animation-spec\SKILL.md,
animation-state-machines,yes,1,Animation state machine skill for transitions.,C:\Users\Treml\.claude\plugins\marketplaces\a5c.ai\library\specializations\game-development\skills\animation-state-machines\SKILL.md,
ansatz-designer,yes,1,Parameterized quantum circuit (ansatz) design skill for variational algorithms,C:\Users\Treml\.claude\plugins\marketplaces\a5c.ai\library\specializations\domains\science\quantum-computing\skills\ansatz-designer\SKILL.md,
